select distinct substring(pay_date, 1, 7) as pay_month , department_id , case when tmp.company_avg > avg(amount) over(partition by department_id, substring(pay_date, 1,7)) then 'lower' when tmp.company_avg < avg(amount) over(partition by department_id, substring(pay_date, 1,7)) then 'higher' else 'same' end as comparison from salary s join employee e using(employee_id) join ( select substring(pay_date, 1, 7) as pay_month , avg(amount) as company_avg from salary group by 1 ) tmp on tmp.pay_month=substring(pay_date, 1, 7)
select left(sal.pay_date,7) as pay_month ,emp.department_id department_id ,case when round(ifnull(avg(sal.amount),0),4) > round(avg_company.avg_company_salary,4) then 'higher' when round(ifnull(avg(sal.amount),0),4) < round(avg_company.avg_company_salary,4) then 'lower' else 'same' end as comparison from employee emp left join salary sal on emp.employee_id = sal.employee_id left join ( select left(pay_date,7) as pay_month ,avg(amount) as avg_company_salary from salary group by pay_month ) avg_company on left(sal.pay_date,7) = avg_company.pay_month group by pay_month, department_id
select left(temp.pay_date,7) as pay_month, temp.department_id, case when temp.a_avg>temp.c_avg then "higher" when temp.a_avg<temp.c_avg then "lower" else "same" end as comparison from (select s.id,s.employee_id,e.department_id, s.amount, s.pay_date, avg(s.amount) over (partition by left(s.pay_date,7), e.department_id) as a_avg, avg(s.amount) over (partition by left(s.pay_date,7)) as c_avg from salary s inner join employee e on e.employee_id=s.employee_id ) as temp group by left(temp.pay_date,7), temp.department_id
select month pay_month, department_id, case when avg_d > avg_o then 'higher' when avg_d < avg_o then 'lower' else 'same' end comparison from (select s.employee_id, department_id, left(pay_date,7) month, avg(amount) over(partition by department_id, left(pay_date,7) order by left(pay_date,7)) avg_d, avg(amount) over(partition by left(pay_date,7) order by left(pay_date,7)) avg_o from salary s, employee e where s.employee_id = e.employee_id) temp group by 1,2
select pay_month, department_id, (case when dep_avg > com_avg then 'higher' when dep_avg < com_avg then 'lower' else 'same' end) as comparison from( select left(pay_date,7) as pay_month, department_id, avg(amount) over (partition by left(pay_date,7), department_id) as dep_avg, avg(amount) over (partition by left(pay_date,7) rows between unbounded preceding and unbounded following) as com_avg from salary s join employee e on s.employee_id = e.employee_id) tbl group by 1,2
select pay_month, department_id, (case when dep_avg > company_avg then 'higher' when dep_avg < company_avg then 'lower' else 'same' end) as comparison from (select left(pay_date,7) as pay_month, department_id, avg(amount) as dep_avg from salary s, employee e where s.employee_id=e.employee_id group by pay_month, department_id) t1, (select avg(amount) as company_avg, left(pay_date,7) as month from salary group by month) t2 where t1.pay_month=t2.month
select pay_month, department_id, (case when dept_avg_sal=comp_avg_sal then "same" when dept_avg_sal<comp_avg_sal then "lower" else "higher" end) comparison from (select DISTINCT LEFT(pay_date,7) as pay_month, department_id, avg(amount) over (partition by LEFT(pay_date,7),department_id) as dept_avg_sal, avg(amount) over (partition by LEFT(pay_date,7)) as comp_avg_sal from salary s left join employee e on e.employee_id = s.employee_id) A
select pay_month, department_id, (case when dept_avg_sal=comp_avg_sal then "same" when dept_avg_sal<comp_avg_sal then "lower" else "higher" end) comparison from (select LEFT(pay_date,7) as pay_month, department_id, avg(amount) as dept_avg_sal, (select avg(amount) from salary where LEFT(pay_date,7) = pay_month) as comp_avg_sal from salary s left join employee e on e.employee_id = s.employee_id group by pay_month,department_id) A
select pay_month, department_id, (case when dpt_avg > month_avg then 'higher' when dpt_avg = month_avg then 'same' else 'lower' end) 'comparison' from (select b.pay_month, department_id, dpt_avg, month_avg from (select pay_month, department_id, avg(amount) as dpt_avg from (select department_id, amount,substr(pay_date,1,7) as 'pay_month' from salary s, employee e where s.employee_id = e.employee_id) a group by a.pay_month, a.department_id) b join (select pay_month, avg(amount) as month_avg from (select department_id, amount,substr(pay_date,1,7) as 'pay_month' from salary s, employee e where s.employee_id = e.employee_id) d group by pay_month) as c on b.pay_month=c.pay_month) final order by pay_month desc, department_id asc
select pay_month, department_id, CASE WHEN average_dept_month > average_month THEN 'higher' when average_dept_month < average_month THEN 'lower' else 'same' end as comparison from ( select distinct e.department_id, left(pay_date,7) as pay_month, avg(amount) over (partition by left(pay_date,7),e.department_id) as average_dept_month, avg(amount) over (partition by left(pay_date,7)) as average_month from salary s left join employee e on s.employee_id = e.employee_id ) ASD order by pay_month desc
select pay_month, department_id, case when dept_avg > comp_avg then 'higher' when dept_avg < comp_avg then 'lower' else 'same' end comparison from ( select date_format(b.pay_date, '%Y-%m') pay_month, a.department_id, avg(b.amount) dept_avg, d.comp_avg from employee a inner join salary b on (a.employee_id = b.employee_id) inner join (select date_format(c.pay_date, '%Y-%m') pay_month, avg(c.amount) comp_avg from salary c group by date_format(c.pay_date, '%Y-%m')) d on ( date_format(b.pay_date, '%Y-%m') = d.pay_month) group by date_format(b.pay_date, '%Y-%m'), department_id, d.comp_avg) final
select pay_month, department_id, case when dept_salary > company_salary then 'higher' when dept_salary < company_salary then 'lower' else 'same' end as comparison from ( select date_format(pay_date, '%Y-%m') as pay_month, department_id, avg(amount) as dept_salary from salary join employee using (employee_id) group by 1, 2 ) temp2 join ( select date_format(pay_date, '%Y-%m') as pay_month, avg(amount) as company_salary from salary group by pay_month ) temp using (pay_month) order by pay_month
select pay_month,department_id , case when e_sal > c_sal then 'higher' when e_sal < c_sal then 'lower' when e_sal = c_sal then 'same' end as comparison from ( select avg(amount) e_sal, avg(cmp_avg) c_sal , department_id, date_format(pay_date, '%Y-%m') pay_month from employee e , salary s , ( select avg(amount) cmp_avg ,date_format(pay_date, '%Y-%m') date from employee e , salary s where e.employee_id = s.employee_id group by 2) b where e.employee_id = s.employee_id and date_format(s.pay_date,'%Y-%m') = b.date group by 3,4 ) xx
select result.pay_month, result.department_id, case when dept_avg>comp_avg then 'higher' when dept_avg<comp_avg then 'lower' else 'same' end as comparison from ( select department_id,avg(amount) as dept_avg,date_format(pay_date,'%Y-%m') as pay_month from salary join employee on salary.employee_id=employee.employee_id group by department_id,pay_month) as result join ( select avg(amount) as comp_avg,date_format(pay_date,'%Y-%m') as pay_month from salary group by pay_month) as comp on result.pay_month=comp.pay_month
select s1.pay_month, s2.department_id, case when s2.avg_department_salary > s1.avg_company_salary then 'higher' when s2.avg_department_salary = s1.avg_company_salary then 'same' else 'lower' end as comparison from( select date_format(pay_date,'%Y-%m') as pay_month, avg(amount) as avg_company_salary from salary group by pay_month ) s1 join ( select date_format(pay_date,'%Y-%m') as pay_month, department_id, avg(amount) as avg_department_salary from salary s join employee e on s.employee_id = e.employee_id group by pay_month, department_id ) s2 on s1.pay_month = s2.pay_month
select s1.pay_month, s2.department_id, case when s2.avg_department_salary > s1.avg_company_salary then 'higher' when s2.avg_department_salary = s1.avg_company_salary then 'same' else 'lower' end as comparison from( select substring(pay_date,1,7) as pay_month, avg(amount) as avg_company_salary from salary group by pay_month ) s1 join ( select substring(pay_date,1,7) as pay_month, department_id, avg(amount) as avg_department_salary from salary s join employee e on s.employee_id = e.employee_id group by pay_month, department_id ) s2 on s1.pay_month = s2.pay_month
select t.pay_month, t.department_id, case when d_avg>c_avg then 'higher' when d_avg=c_avg then 'same' when d_avg<c_avg then 'lower' end as comparison from (select pay_month, department_id, avg(amount) as d_avg from ( select s.*, DATE_FORMAT(pay_date, '%Y-%m') as pay_month, d.department_id from salary s join employee d on s.employee_id=d.employee_id ) e group by pay_month, department_id) t join ( select pay_month, avg(amount) as c_avg from ( select sal.*, DATE_FORMAT(pay_date, '%Y-%m') as pay_month, dep.department_id from salary sal join employee dep on sal.employee_id=dep.employee_id ) emp group by pay_month ) l on t.pay_month=l.pay_month
select t1.pay_month as pay_month, department_id, case when t1.average_month>t2.average_month then 'higher' when t1.average_month<t2.average_month then 'lower' else 'same' end as comparison from ( select LEFT(pay_date, 7) as pay_month, department_id, avg(amount) as average_month from employee, salary where employee.employee_id = salary.employee_id group by pay_month, department_id ) t1 JOIN ( select LEFT(pay_date, 7) as pay_month, avg(amount) as average_month from salary group by pay_month ) t2 ON t1.pay_month = t2.pay_month order by department_id, pay_month
select t1.pay_month, t1.department_id, case when t1.department_salary > t2.company_salary then "higher" when t1.department_salary < t2.company_salary then "lower" else "same" end as "comparison" from ((select left(s.pay_date, 7) pay_month, e.department_id, avg(s.amount) department_salary from salary s, employee e where s.employee_id = e.employee_id group by e.department_id, pay_month) as t1 left join (select left(s.pay_date, 7) pay_month, avg(s.amount) company_salary from salary s, employee e where s.employee_id = e.employee_id group by pay_month) as t2 on t1.pay_month = t2.pay_month) order by pay_month desc, department_id
select x.pay_mon as pay_month,x.department_id, case when x.avg_amt=y.t_avg_amt then "same" when x.avg_amt<y.t_avg_amt then "lower" else "higher" end as comparison from (select e.department_id,s.pay_mon,avg(s.amount) as avg_amt from (select employee_id,amount,substr(pay_date,1,7) as pay_mon from salary) s left join employee e on s.employee_id=e.employee_id group by s.pay_mon,e.department_id) x left join (select y.pay_mon,avg(amount) as t_avg_amt from (select substr(pay_date,1,7) as pay_mon,amount from salary ) y group by y.pay_mon) y on x.pay_mon=y.pay_mon order by 1 desc,2 asc
with A as( select date_format(pay_date, '%Y-%m') as "pay_month", department_id, avg(amount) as "dep_avg" from salary s join employee e on s.employee_id = e.employee_id group by 2,1 ), b as( select date_format(pay_date, '%Y-%m') as "pay_month", avg(amount) as "mon_avg" from salary s join employee e on s.employee_id = e.employee_id group by 1 ) select A.pay_month, A.department_id, case when A.dep_avg > B.mon_avg then "higher" when A.dep_avg < B.mon_avg then "lower" else "same" end as "comparison" from A join B on A.pay_month = B.pay_month
with CTE AS ( select LEFT(s.pay_date,7) as pay_month,e.department_id as department_id, AVG(s.amount) OVER(PARTITION BY s.pay_date) as company_avg, AVG(s.amount) OVER(Partition By e.department_id,s.pay_date) as department_avg from salary s, employee e where e.employee_id = s.employee_id ) select pay_month,department_id , (CASE WHEN department_avg > company_avg THEN "higher" WHEN department_avg < company_avg THEN "lower" WHEN department_avg = company_avg THEN "same" END) as comparison from CTE group by pay_month,department_id
with a as(select avg(amount) as tot_avg, DATE_format(pay_date,'%Y-%m') as pay_month from salary group by DATE_format(pay_date,'%Y-%m')), b as (select DATE_format(pay_date,'%Y-%m') as pay_month , e.department_id, avg(s.amount) as dept_avg from employee e join salary s on e.employee_id = s.employee_id group by DATE_format(pay_date,'%Y-%m'), e.department_id) select a.pay_month, b.department_id, case when b.dept_avg > a.tot_avg then 'higher' when b.dept_avg < a.tot_avg then 'lower' else 'same' end as comparison from a join b on a.pay_month = b.pay_month
with avg_comp_salary AS ( SELECT pay_date, AVG(amount) AS avg_salary FROM salary GROUP BY pay_date ), avg_dpt_salary AS ( SELECT s.pay_date, e.department_id, AVG(s.amount) AS avg_salary FROM salary s INNER JOIN employee e ON s.employee_id = e.employee_id GROUP BY e.department_id , s.pay_date ) SELECT DISTINCT DATE_FORMAT(avg_comp_salary.pay_date, '%Y-%m') AS pay_month, avg_dpt_salary.department_id, CASE WHEN avg_comp_salary.avg_salary = avg_dpt_salary.avg_salary THEN 'same' WHEN avg_comp_salary.avg_salary < avg_dpt_salary.avg_salary THEN 'higher' WHEN avg_comp_salary.avg_salary > avg_dpt_salary.avg_salary THEN 'lower' ELSE NULL END AS comparison FROM avg_comp_salary INNER JOIN avg_dpt_salary ON avg_comp_salary.pay_date = avg_dpt_salary.pay_date
with avg_monthly as( select DATE_FORMAT(pay_date,'%Y-%m') as month, avg(s.amount) as avg_month from salary s join employee e on s.employee_id = e.employee_id group by month(s.pay_date) ), avg_department as( select e.department_id, DATE_FORMAT(pay_date,'%Y-%m') as month, avg(s.amount) as avg_dep_month from salary s join employee e on s.employee_id = e.employee_id group by month(s.pay_date), e.department_id ) select ad.month as pay_month, ad.department_id, (case when avg_dep_month > avg_month then 'higher' when avg_dep_month < avg_month then 'lower' else 'same' end) as comparison from avg_department ad join avg_monthly am on ad.month = am.month
with avg_salary as ( select date_format(pay_date, '%Y-%m') as pay_month, avg(amount) as avg_pay from salary s group by 1 ) , dep_salary as ( select date_format(pay_date, '%Y-%m') as pay_month, e.department_id, avg(amount) as avg_dep_pay from employee e inner join salary s on s.employee_id = e.employee_id group by 1,2 ) select d.pay_month, d.department_id, case when avg_dep_pay > a.avg_pay then 'higher' when avg_dep_pay < a.avg_pay then 'lower' else 'same' end as comparison from dep_salary d left join avg_salary a on a.pay_month = d.pay_month order by 1,2
with c as ( select date_format(pay_date, '%Y-%m') as pay_month, department_id, avg(amount) over(partition by date_format(pay_date, '%Y-%m')) as a, avg(amount) over(partition by date_format(pay_date, '%Y-%m'), department_id) as b from salary s inner join employee e on s.employee_id = e.employee_id ) select distinct pay_month, department_id, case when b > a then 'higher' when b < a then 'lower' else 'same' end as comparison from c order by pay_month desc, department_id
with cmp as ( select left(pay_date,7) as month, avg(amount) as cm_avg from salary group by 1 ) ,dept as ( select department_id, left(pay_date,7) as month, avg(amount) dpt_avg from salary s join employee e on s.employee_id=e.employee_id group by 1,2 ) select cmp.month as pay_month, department_id, case when cm_avg>dpt_avg then "lower" when cm_avg<dpt_avg then "higher" else "same" end as comparison from cmp left join dept on cmp.month=dept.month
with comp_avg as (select left(pay_date,7) as pay_month, sum(amount)/count(*) as average from salary group by left(pay_date,7)), dept_avg as ( select left(s.pay_date,7) as pay_month, d.department_id, sum(s.amount)/count(*) as average from salary s, employee d where s.employee_id = d.employee_id group by left(s.pay_date,7), d.department_id ) select comp_avg.pay_month, dept_avg.department_id, case when dept_avg.average>comp_avg.average then 'higher' when dept_avg.average = comp_avg.average then 'same' else 'lower' end as comparison from comp_avg, dept_avg where comp_avg.pay_month = dept_avg.pay_month
with company as ( select date_format(pay_date, '%Y-%m') as pay_month, sum(amount) / count(*) as company_average from salary group by pay_month ), department as ( select t2.department_id, date_format(t1.pay_date, '%Y-%m') as pay_month, sum(t1.amount) / count(*) as department_average from salary t1 join employee t2 on t2.employee_id = t1.employee_id group by t2.department_id, pay_month ) select t1.pay_month, t1.department_id, case when t1.department_average > t2.company_average then 'higher' when t1.department_average < t2.company_average then 'lower' else 'same' end as comparison from department t1 join company t2 on t2.pay_month = t1.pay_month order by t1.pay_month desc, t1.department_id asc
with company_avg_sal As ( select substr(pay_date,1,7) pay_month,avg(amount) comp_avg_sal from salary group by 1 ), dept_avg_salary AS ( select substr(pay_date,1,7) pay_month,department_id, avg(amount) dept_avg_sal from Salary s inner join employee e on s.employee_id = e.employee_id group by 1,department_id ) select cs.pay_month, department_id, case when dept_avg_sal > cs.comp_avg_sal then 'higher' when dept_avg_sal = comp_avg_sal then 'same' when dept_avg_sal < comp_avg_sal then 'lower' end as comparison from company_avg_sal cs inner join dept_avg_salary ds on cs.pay_month = ds.pay_month
with compavg as ( select substring(pay_date , 1,7) as pay_month, avg(amount) as avgcompsalary from salary group by 1) , avgdept as (select distinct substring(pay_date , 1,7) as pay_month,department_id, avg(amount) as deptavgsalary from salary join employee on employee.employee_id = salary.employee_id group by 1,2) select k2.pay_month, k2.department_id , case when deptavgsalary > avgcompsalary then 'higher' when deptavgsalary < avgcompsalary then 'lower' else 'same' end as comparison from compavg k1 join avgdept k2 on k2.pay_month = k1.pay_month
with ct as (select a.pay_date, b.department_id, avg(a.amount) over(partition by a.pay_date) as company_avg, avg(a.amount) over(partition by a.pay_date, b.department_id ) as dep_avg from salary a join employee b on a.employee_id = b.employee_id order by 1 desc, 2 ) select substring(pay_date,1,7) as pay_month, department_id, case when dep_avg > company_avg then 'higher' when dep_avg < company_avg then 'lower' else 'same' end as comparison from ct group by 1, 2
with cte as ( SELECT LEFT(pay_date ,7) as pay_month, department_id, AVG(amount)OVER(PARTITION BY pay_date) as 'Avg_all', AVG(amount)OVER(PARTITION by pay_date, department_id) as 'Avg_dep' FROM salary JOIN employee USING(employee_id)) SELECT pay_month, department_id, (CASE WHEN Avg_dep >Avg_all THEN 'higher' WHEN Avg_dep <Avg_all THEN 'lower' ELSE 'same' END) as comparison FROM cte GROUP BY 1,2
with cte as ( SELECT Left(pay_date,7) as pay_month,department_id, AVG(amount)OVER(PARTITION BY pay_date) as 'com_avg', AVG(amount)OVER(PARTITION BY department_id, pay_date) as 'dep_avg' FROM salary join employee USING(employee_id)) SELECT distinct pay_month, department_id, (CASE WHEN dep_avg>com_avg THEN 'higher' WHEN dep_avg<com_avg THEN 'lower' ELSE 'same' END) as comparison FROM cte ORDER BY pay_month DESC, department_id
with cte as ( SELECT date_format(pay_date,'%Y-%m') as pay_month, department_id, avg(amount) over (Partition by department_id,date_format(pay_date,'%Y-%m')) as depar_monthly_avg, avg(amount) over(PARTITION by date_format(pay_date,'%Y-%m')) as company_monthly_avg from salary join employee on salary.employee_id=employee.employee_id) SELECT distinct pay_month, department_id, case when depar_monthly_avg > company_monthly_avg then 'higher' when depar_monthly_avg < company_monthly_avg then 'lower' else 'same' end as comparison FROM cte order by 1 desc,2
with cte as ( select avg(amount) avg_salary_company, date_format(pay_date,"%Y-%m") as pay_month from salary s join employee e on s.employee_id=e.employee_id group by date_format(pay_date,"%Y-%m") ) ,cte2 as (select avg(amount) as avg_salary_department, department_id, date_format(pay_date,"%Y-%m") as pay_month from salary s join employee e on s.employee_id=e.employee_id group by department_id,date_format(pay_date,"%Y-%m") ) select cte.pay_month as pay_month, department_id, case when avg_salary_department > avg_salary_company then 'higher' when avg_salary_department < avg_salary_company then 'lower' else 'same' end as comparison from cte join cte2 on cte2.pay_month=cte.pay_month
with cte as ( select date_format(pay_date, '%Y-%m') as pay_month, amount, department_id from salary s left join employee e on s.employee_id = e.employee_id ), cte2 as ( select pay_month, avg(amount) as c_amt from cte group by pay_month), cte3 as ( select pay_month, department_id, avg(amount) as d_amt from cte group by pay_month, department_id) select cte3.pay_month, department_id, (case when d_amt > c_amt then 'higher' when d_amt = c_amt then 'same' else 'lower' end) as comparison from cte3 left join cte2 on cte3.pay_month = cte2.pay_month
with cte as ( select date_format(pay_date, '%Y-%m') month, avg(amount) avg_salary from salary s join employee e on s.employee_id=e.employee_id group by date_format(pay_date, '%Y-%m')) , cte2 as ( select department_id,date_format(pay_date, '%Y-%m') mon, avg(amount) amt from salary s join employee e on s.employee_id=e.employee_id group by department_id, date_format(pay_date, '%Y-%m') ) select c.month pay_month, d.department_id, (case when c.avg_salary<d.amt then 'higher' when c.avg_salary>d.amt then 'lower' else 'same' end) comparison from cte c join cte2 d on c.month=d.mon
with cte as ( select date_format(pay_date,'%Y-%m') as pay_month,avg(amount) comp_avg from salary group by date_format(pay_date,'%Y-%m') ) select date_format(salary.pay_date,'%Y-%m') as pay_month,employee.department_id, CASE WHEN round(AVG(salary.amount),2) > round(cte.comp_avg,2) THEN 'higher' WHEN round(AVG(salary.amount),2) < round(cte.comp_avg,2) THEN 'lower' ELSE 'same' END as comparison from salary inner join employee on employee.employee_id = salary.employee_id inner join cte on cte.pay_month = date_format(pay_date,'%Y-%m') group by date_format(pay_date,'%Y-%m'),employee.department_id
with cte as ( select date_format(s.pay_date,'%Y-%m') as pay_month, e.department_id, avg(s.amount) as avg_amount from salary s join employee e on s.employee_id = e.employee_id group by pay_month, e.department_id ), cte1 as ( select date_format(pay_date,'%Y-%m') as pay_month, avg(amount) as am from salary group by pay_month ) select cte1.pay_month, cte.department_id, case when cte.avg_amount> cte1.am then 'higher' when cte.avg_amount<cte1.am then 'lower' when cte.avg_amount=cte1.am then 'same' else null end as comparison from cte left join cte1 on cte.pay_month= cte1.pay_month
with cte as ( select date_format(s.pay_date,'%Y-%m') as pay_month, e.department_id, avg(s.amount) as avg_amount from salary s join employee e on s.employee_id = e.employee_id group by pay_month, e.department_id ), cte1 as ( select date_format(pay_date,'%Y-%m') as pay_month,avg(amount) as am from salary group by pay_month ) select cte1.pay_month, cte.department_id, case when cte.avg_amount> cte1.am then 'higher' when cte.avg_amount<cte1.am then 'lower' when cte.avg_amount=cte1.am then 'same' else null end as comparison from cte left join cte1 on cte.pay_month= cte1.pay_month
with cte as ( select department_id,avg(amount) as amt,pay_date from (select department_id,amount,substr(pay_date,1,7) as pay_date from salary join employee on salary.employee_id = employee.employee_id)t1 group by pay_date,department_id ) , cte1 as ( select cte.department_id,cte.pay_date,cte.amt,gamt from cte join (select avg(amount) as gamt,substr(pay_date,1,7) as pay_date from salary group by substr(pay_date,1,7))t1 on t1.pay_date = cte.pay_date ) select pay_date as pay_month,department_id, case when amt > gamt then "higher" when amt = gamt then "same" else "lower" end as comparison from cte1
with cte as ( select left(z.pay_date,7) as pay_month ,z.department_id as department_id ,avg(z.avg_comp) as avg_com, avg(z.avg_dept) as avg_dept from ( select a.pay_date,b.department_id,avg(a.amount)over(partition by month(a.pay_date)) as avg_comp, avg(a.amount) over (partition by month (a.pay_date),b.department_id) as avg_dept from salary a join employee b on a.employee_id=b.employee_id) z group by left(z.pay_date,7),z.department_id) select pay_month,department_id, case when avg_dept> avg_com then 'higher' when avg_dept< avg_com then 'lower' when avg_dept= avg_com then 'same' end as Comparison from cte
with cte as ( select substr(pay_date,1,7) as pay_month, avg(amount) as comp_avg from salary group by 1), cte1 as (select substr(pay_date,1,7) as pay_month, department_id, avg(amount) as dep_avg from salary x join employee y on x.employee_id = y.employee_id group by 1,2) select a.pay_month, b.department_id, case when b.dep_avg < a.comp_avg then 'lower' when b.dep_avg = a.comp_avg then 'same' else 'higher' end as comparison from cte a left join cte1 b on a.pay_month = b.pay_month
with cte as ( with cte as ( with cte as ( Select s.employee_id,s.amount,s.pay_date,e.department_id, avg(s.amount) over(partition by month(pay_date)) as 'monthly_average' from salary s inner join employee e on s.employee_id = e.employee_id ) Select *, avg(amount) over(partition by month(pay_date),department_id) as 'department_average' from cte ) Select left(pay_date,7) as 'pay_month',monthly_average,department_average,department_id from cte group by left(pay_date,7),department_id ) Select pay_month , department_id, case when department_average > monthly_average then 'higher' when department_average < monthly_average then 'lower' when department_average = monthly_average then 'same' end as 'comparison' from cte
