SELECT A.pay_month, department_id, (CASE WHEN depart_avg > comp_avg THEN "higher" WHEN depart_avg = comp_avg THEN "same" ELSE "lower" END) AS comparison FROM (SELECT SUBSTRING(pay_date, 1, 7) AS pay_month, department_id, AVG(amount) AS depart_avg FROM salary INNER JOIN employee ON salary.employee_id = employee.employee_id GROUP BY SUBSTRING(pay_date, 1, 7), department_id) A INNER JOIN (SELECT SUBSTRING(pay_date, 1, 7) AS pay_month, AVG(amount) AS comp_avg FROM salary GROUP BY SUBSTRING(pay_date, 1, 7)) B ON A.pay_month = B.pay_month
SELECT DISTINCT (CASE WHEN MONTH(B.pay_date) - 10 < 0 THEN CONCAT(CONVERT(YEAR(B.pay_date), CHAR), CONCAT('-0',CONVERT(MONTH(B.pay_date), CHAR))) ELSE CONCAT(CONVERT(YEAR(B.pay_date), CHAR), CONCAT('-',CONVERT(MONTH(B.pay_date), CHAR))) END) AS pay_month, B.dep AS department_id, (CASE WHEN B.sal > C.pay THEN 'higher' WHEN B.sal < C.pay THEN 'lower' ELSE 'same' END) comparison FROM (SELECT A.dep, A.pay_date, AVG(A.sal) sal FROM (SELECT E.department_id AS dep, S.amount sal, S.pay_date FROM salary S LEFT JOIN employee E ON S.employee_id = E.employee_id) AS A GROUP BY A.dep, A.pay_date) B LEFT JOIN (SELECT pay_date, AVG(amount) pay FROM salary GROUP BY pay_date) C ON B.pay_date = C.pay_date
SELECT DISTINCT date_format(pay_date, '%Y-%m') as pay_month, department_id, CASE WHEN AVG(amount) OVER(PARTITION BY department_id, pay_date) > AVG(amount) OVER(PARTITION BY pay_date) THEN 'higher' WHEN AVG(amount) OVER(PARTITION BY department_id, pay_date) < AVG(amount) OVER(PARTITION BY pay_date) THEN 'lower' ELSE 'same' END AS comparison FROM salary JOIN employee ON salary.employee_id = employee.employee_id ORDER BY pay_month DESC, department_id ASC
SELECT DISTINCT pay_month, department_id, (CASE WHEN department_avg_salary > company_avg_salary THEN 'higher' WHEN department_avg_salary < company_avg_salary THEN 'lower' WHEN department_avg_salary = company_avg_salary THEN 'same' END) AS comparison FROM ( SELECT A.employee_id, amount, pay_date,department_id, LEFT(pay_date,7) as pay_month, AVG(amount) OVER(PARTITION BY A.pay_date) AS company_avg_salary, AVG(amount) OVER(PARTITION BY A.pay_date, B.department_id) AS department_avg_salary FROM salary AS A JOIN employee AS B ON A.employee_id = B.employee_id) AS temp
SELECT DISTINCT pay_month, department_id, CASE WHEN department_avg > company_avg THEN 'higher' WHEN department_avg < company_avg THEN 'lower' ELSE 'same' END AS comparison FROM (SELECT s.*, e.department_id, LEFT(s.pay_date, 7) AS pay_month, AVG(amount) OVER(PARTITION BY LEFT(s.pay_date, 7)) AS company_avg, AVG(amount) OVER(PARTITION BY LEFT(s.pay_date, 7), e.department_id) AS department_avg FROM salary s JOIN employee e ON s.employee_id = e.employee_Id ) tmp ORDER BY pay_month DESC, department_id
SELECT DISTINCT pay_month, department_id, CASE WHEN department_avg > month_avg THEN 'higher' WHEN department_avg = month_avg THEN 'same' WHEN department_avg < month_avg THEN 'lower' END AS comparison FROM (SELECT DATE_FORMAT(pay_date, '%Y-%m') AS pay_month, department_id, AVG(amount) OVER(PARTITION BY DATE_FORMAT(pay_date, '%Y-%m')) AS month_avg, AVG(amount) OVER(PARTITION BY DATE_FORMAT(pay_date, '%Y-%m'), department_id) AS department_avg FROM salary s JOIN employee e ON s.employee_id = e.employee_id) a
SELECT SUBSTRING(a.pay_date,1,7) AS 'pay_month' , b.department_id , CASE WHEN ROUND(SUM(a.amount)/c.employee_count,2) > d.company_avg THEN 'higher' WHEN ROUND(SUM(a.amount)/c.employee_count,2) < d.company_avg THEN 'lower' ELSE 'same' END AS 'comparison' FROM salary a LEFT JOIN employee b ON a.employee_id=b.employee_id LEFT JOIN (SELECT department_id , COUNT(DISTINCT employee_id) AS 'employee_count' FROM employee GROUP BY department_id) c ON b.department_id=c.department_id LEFT JOIN (SELECT SUBSTRING(pay_date,1,7) AS 'pay_date' , ROUND(AVG(amount),2) AS 'company_avg' FROM salary GROUP BY SUBSTRING(pay_date,1,7)) d ON SUBSTRING(a.pay_date,1,7)=SUBSTRING(d.pay_date,1,7) GROUP BY b.department_id ,SUBSTRING(a.pay_date,1,7)
SELECT Sub.pay_month, Sub.department_id, CASE WHEN Sub.dpt_avg > Sub.company_avg THEN 'higher' WHEN Sub.dpt_avg < Sub.company_avg THEN 'lower' ELSE 'same' END AS comparison FROM ( SELECT S.*, E.department_id, AVG(S.amount) OVER (PARTITION BY S.pay_date) AS company_avg, AVG(S.amount) OVER (PARTITION BY S.pay_date, E.department_id) AS dpt_avg, DATE_FORMAT(S.pay_date, '%Y-%m') AS pay_month FROM salary S LEFT JOIN employee E ON S.employee_id = E.employee_id ORDER BY S.id ) Sub GROUP BY Sub.pay_month, Sub.department_id ORDER BY Sub.pay_month DESC, Sub.department_id
SELECT a.pay_month , a.department_id , CASE WHEN a.avg_dept_sal > a.avg_comp_sal then 'higher' WHEN a.avg_dept_sal = a.avg_comp_sal then 'same' ELSE 'lower' END AS comparison FROM ( SELECT DISTINCT LEFT(pay_date, 7) AS pay_month , e.department_id , AVG(amount) OVER(PARTITION BY LEFT(pay_date, 7)) AS avg_comp_sal , AVG(amount) OVER(PARTITION BY LEFT(pay_date, 7), e.department_id) AS avg_dept_sal FROM salary s JOIN employee e ON s.employee_id = e.employee_id )a order by a.pay_month DESC
SELECT department_salary.pay_month AS pay_month, department_id, CASE WHEN department_avg > company_avg THEN 'higher' WHEN department_avg < company_avg THEN 'lower' ELSE 'same' END AS comparison FROM ( SELECT department_id, AVG(amount) AS department_avg, DATE_FORMAT(pay_date, '%Y-%m') AS pay_month FROM salary JOIN employee ON salary.employee_id = employee.employee_id GROUP BY department_id, pay_month ) AS department_salary JOIN ( SELECT AVG(amount) AS company_avg, DATE_FORMAT(pay_date, '%Y-%m') AS pay_month FROM salary GROUP BY pay_month ) AS company_salary ON department_salary.pay_month = company_salary.pay_month
SELECT distinct C.pay_month, C.department_id, CASE WHEN dept_salary>cmpy_salary then 'higher' WHEN dept_salary<cmpy_salary then 'lower' ELSE 'same' END AS comparison FROM (SELECT LEFT(pay_date,7) as pay_month, B.department_id, AVG(amount) OVER (PARTITION BY B.department_id, LEFT(pay_date,7)) AS dept_salary ,AVG(amount) OVER (PARTITION BY LEFT(pay_date,7)) AS cmpy_salary FROM salary A INNER JOIN employee B ON A.employee_id = B.employee_id)C
SELECT pay_month, department_id, CASE WHEN CompanyAverage = departmentAverage then "same" WHEN CompanyAverage < departmentAverage then"higher" ELSE "lower" END AS comparison FROM (SELECT DISTINCT DATE_FORMAT(pay_date, "%Y-%m") as pay_month, department_id, AVG(amount) Over(Partition by DATE_FORMAT(pay_date, "%Y-%m")) as CompanyAverage , AVG(amount) Over(Partition by DATE_FORMAT(pay_date, "%Y-%m"),department_id) as departmentAverage FROM EMPLOYEE E LEFT JOIN SALARY S ON E.employee_id =S.employee_id ) MonthlyDeptCompAvg
SELECT pay_month, department_id, CASE WHEN CompanyAverage = departmentAverage then "same" WHEN CompanyAverage < departmentAverage then"higher" ELSE "lower" END AS comparison FROM (SELECT DISTINCT DATE_FORMAT(pay_date, "%Y-%m") as pay_month, department_id, AVG(amount) Over(Partition by DATE_FORMAT(pay_date, "%Y-%m")) as CompanyAverage , AVG(amount) Over(Partition by DATE_FORMAT(pay_date, "%Y-%m"),department_id) as departmentAverage FROM EMPLOYEE E LEFT JOIN SALARY S ON E.employee_id =S.employee_id ) MonthlyDeptCompAvg Order by pay_month DESC, department_id
SELECT pay_month, department_id, comparison FROM ( SELECT LEFT(pay_date, 7) AS pay_month, department_id, CASE WHEN AVG(amount) OVER (PARTITION BY LEFT(pay_date, 7), department_id) > AVG(amount) OVER (PARTITION BY LEFT(pay_date, 7)) THEN 'higher' WHEN AVG(amount) OVER (PARTITION BY LEFT(pay_date, 7), department_id) = AVG(amount) OVER (PARTITION BY LEFT(pay_date, 7)) THEN 'same' ELSE 'lower' END AS comparison, ROW_NUMBER() OVER (PARTITION BY LEFT(pay_date, 7), department_id) AS row_ct FROM salary s INNER JOIN employee e ON s.employee_id = e.employee_id ) sub WHERE row_ct = 1 ORDER BY pay_month DESC, department_id
SELECT pay_month,department_id,(CASE WHEN dep_avg>company_avg THEN "higher" WHEN dep_avg=company_avg THEN "same" WHEN dep_avg<company_avg THEN "lower" END) AS comparison FROM (SELECT DISTINCT SUBSTRING(pay_date,1,7) AS pay_month,department_id, AVG(amount)OVER(PARTITION BY SUBSTRING(pay_date,1,7),department_id) AS dep_avg ,AVG(amount)OVER(PARTITION BY SUBSTRING(pay_date,1,7)) AS company_avg FROM salary JOIN employee comparison USING (employee_id)) AS temp
SELECT t.pay_month ,t.department_id ,CASE WHEN t.dept_salary>t1.company_salary THEN 'higher' WHEN t.dept_salary<t1.company_salary THEN 'lower' WHEN t.dept_salary=t1.company_salary THEN 'same' END comparison FROM (SELECT AVG(s.amount) dept_salary, e.department_id, date_format(pay_date,'%Y-%m') pay_month FROM salary s INNER JOIN employee e ON e.employee_id=s.employee_id GROUP BY e.department_id ,date_format(s.pay_date,'%Y-%m'))t INNER JOIN (SELECT AVG(s.amount) company_salary, date_format(s.pay_date,'%Y-%m') pay_month FROM salary s INNER JOIN employee e ON e.employee_id=s.employee_id GROUP BY date_format(s.pay_date,'%Y-%m') )t1 ON t.pay_month=t1.pay_month
SELECT t.pay_month,t.department_id, CASE WHEN t.aavg > t2.cavg THEN 'higher' WHEN t.aavg < t2.cavg THEN 'lower' WHEN t.aavg = t2.cavg THEN 'same' END AS comparison FROM (SELECT LEFT(pay_date,7) AS pay_month, department_id, AVG(amount) AS aavg FROM salary s JOIN employee e ON s.employee_id = e.employee_id GROUP BY pay_month, department_id) t JOIN (SELECT LEFT(pay_date,7) AS pay_month, department_id, AVG(amount) AS cavg FROM salary s JOIN employee e ON s.employee_id = e.employee_id GROUP BY pay_month) t2 ON t.pay_month = t2.pay_month
SELECT tt1.pay_month, tt1.department_id, CASE WHEN tt1.avg > tt2.avg_month THEN 'higher' WHEN tt1.avg < tt2.avg_month THEN 'lower' WHEN tt1.avg = tt2.avg_month THEN 'same' END as comparison FROM ( SELECT avg(amount) as avg, department_id, pay_month FROM ( SELECT e.department_id, s.amount, date_format(pay_date, '%Y-%m') as pay_month FROM salary s JOIN employee e ON s.employee_id = e.employee_id ORDER BY pay_month ) as t1 GROUP BY department_id, pay_month ) as tt1 JOIN ( SELECT avg(amount) as avg_month, pay_month FROM ( SELECT e.department_id, s.amount, date_format(pay_date, '%Y-%m') as pay_month FROM salary s JOIN employee e ON s.employee_id = e.employee_id ORDER BY pay_month ) as t2 GROUP BY pay_month ) as tt2 ON tt1.pay_month = tt2.pay_month
Select R.pay_month, R.department_id, (Case when R.department_avg > C.company_avg then 'higher' when R.department_avg = C.company_avg then 'same' else 'lower' end) as comparison From (Select Left(S.pay_date, 7) as pay_month, E.department_id, Avg(S.amount) as department_avg From Salary as S Join employee E on S.employee_id = E.employee_id Group by E.department_id, pay_month) R Join (Select Left(pay_date, 7) as pay_month, Avg(amount) AS company_avg From salary Group by pay_month) C on R.pay_month = C.pay_month Order by 1,2
Select dept_month_salary.pay_month, dept_month_salary.department_id, Case When dept_month_salary.dept_avg_salary > comp_month_salary.comp_avg_salary Then 'higher' When dept_month_salary.dept_avg_salary = comp_month_salary.comp_avg_salary Then 'same' Else 'lower' End As comparison From (Select SubStr(pay_date ,1,7) as pay_month, employee.department_id as department_id, AVG(amount) as dept_avg_salary From salary Left Join employee On salary.employee_id = employee.employee_id Group By employee.department_id, SubStr(pay_date ,1,7)) as dept_month_salary Left Join (Select SubStr(pay_date ,1,7) as pay_month, AVG(amount) as comp_avg_salary From salary Group By SubStr(pay_date ,1,7)) as comp_month_salary On dept_month_salary.pay_month = comp_month_salary.pay_month
WITH A AS (SELECT LEFT(S1.PAY_DATE,7) AS MONTH, E1.DEPARTMENT_ID, AVG(S1.AMOUNT) AS ES FROM EMPLOYEE E1 JOIN SALARY S1 ON E1.EMPLOYEE_ID = S1.EMPLOYEE_ID GROUP BY MONTH, E1.DEPARTMENT_ID), C AS (SELECT LEFT(S2.PAY_DATE,7) AS M, AVG(S2.AMOUNT) AS CS FROM SALARY S2 GROUP BY M) SELECT A.MONTH AS PAY_MONTH, A.DEPARTMENT_ID, CASE WHEN ES > CS THEN 'higher' WHEN ES < CS THEN 'lower' ELSE 'same' END AS COMPARISON FROM A JOIN C ON A.MONTH = C.M
WITH A AS (SELECT LEFT(S1.PAY_DATE,7) AS MONTH, E1.DEPARTMENT_ID, AVG(S1.AMOUNT) AS SAL FROM EMPLOYEE E1 JOIN SALARY S1 ON E1.EMPLOYEE_ID = S1.EMPLOYEE_ID GROUP BY MONTH, E1.DEPARTMENT_ID), C AS (SELECT LEFT(S2.PAY_DATE,7) AS M, AVG(S2.AMOUNT) AS CAL FROM SALARY S2 GROUP BY M) SELECT A.MONTH AS PAY_MONTH, A.DEPARTMENT_ID, CASE WHEN SAL > CAL THEN 'higher' WHEN SAL < CAL THEN 'lower' ELSE 'same' END AS COMPARISON FROM A JOIN C ON A.MONTH = C.M
WITH Averages as ( select s.id, s.employee_id, e.department_id, s.amount, date_format(pay_date, '%Y-%m') as pay_month, avg(amount) over (partition by pay_date order by pay_date) as CompAvg, avg(amount) over (partition by pay_date, e.department_id order by pay_date, e.department_id ) as DeptAvg from salary as s join employee as e on s.employee_id = e.employee_id ) select distinct pay_month, department_id, CASE WHEN DeptAvg > CompAvg THEN 'higher' WHEN DeptAvg < CompAvg THEN 'lower' ELSE 'same' END as comparison from Averages
WITH COMPANY_AVG AS ( SELECT DATE_FORMAT(PAY_DATE,'%Y-%m') pay_month ,AVG(AMOUNT) pay_avg FROM SALARY GROUP BY 1 ) , DEPARTMENT_AVG AS ( SELECT E.DEPARTMENT_ID ,DATE_FORMAT(PAY_DATE,'%Y-%m') pay_month ,AVG(AMOUNT) dept_avg FROM SALARY S JOIN EMPLOYEE E ON S.EMPLOYEE_ID=E.EMPLOYEE_ID GROUP BY 1,2 ) SELECT CA.PAY_MONTH pay_month ,DA.DEPARTMENT_ID department_id ,CASE WHEN DEPT_AVG > PAY_AVG THEN 'higher' WHEN DEPT_AVG < PAY_AVG THEN 'lower' ELSE 'same' END AS comparison FROM COMPANY_AVG CA JOIN DEPARTMENT_AVG DA ON CA.PAY_MONTH = DA.PAY_MONTH
WITH COMPANY_AVG_SAL AS ( SELECT DATE_FORMAT(pay_date, '%Y-%m') AS pay_month, AVG(s.amount) AS co_avg FROM salary s GROUP BY 1 ), dept_avg AS ( SELECT DATE_FORMAT(s.pay_date, '%Y-%m') AS pay_month, e.department_id, AVG(s.amount) AS dept_avg FROM salary s INNER JOIN employee e ON s.employee_id = e.employee_id GROUP BY 1, 2 ) SELECT da.pay_month, da.department_id, CASE WHEN da.dept_avg > cas.co_avg THEN 'higher' WHEN da.dept_avg < cas.co_avg THEN 'lower' ELSE 'same' END AS 'comparison' FROM dept_avg da INNER JOIN COMPANY_AVG_SAL cas ON da.pay_month = cas.pay_month
WITH CTE AS ( SELECT SUBSTRING(pay_date,1,7) pay_month, AVG(amount) comp_avg FROM salary GROUP BY SUBSTRING(pay_date,1,7) ), CTE1 AS ( SELECT SUBSTRING(s.pay_date,1,7) pay_month, e.department_id, AVG(s.amount) dept_avg FROM salary s INNER JOIN employee e ON s.employee_id=e.employee_id GROUP BY SUBSTRING(s.pay_date,1,7), e.department_id ) SELECT c1.pay_month, c2.department_id, CASE WHEN c2.dept_avg=c1.comp_avg THEN 'same' WHEN c2.dept_avg>c1.comp_avg THEN 'higher' ELSE 'lower' END comparison FROM CTE c1 INNER JOIN CTE1 C2 ON C1.pay_month=C2.pay_month
WITH CTE AS (SELECT LEFT(pay_date,7) pay_month, department_id, AVG(amount) OVER(PARTITION BY MONTH(pay_date)) company_avg, AVG(amount) OVER(PARTITION BY MONTH(pay_date), department_id) department_avg FROM salary S1 JOIN employee E1 ON S1.employee_id = E1.employee_id) SELECT DISTINCT pay_month, department_id, (CASE WHEN department_avg > company_avg THEN 'higher' WHEN department_avg < company_avg THEN 'lower' ELSE 'same' END) comparison FROM CTE
WITH CTE AS (SELECT e.department_id, LEFT(s.pay_date,7) as pay_month, AVG(amount)OVER(PARTITION BY e.department_id,LEFT(s.pay_date,7)) as dept_avg, AVG(amount) OVER(PARTITION BY LEFT(s.pay_date,7)) as comp_avg FROM salary s JOIN employee e ON s.employee_id = e.employee_id) SELECT pay_month, department_id, CASE WHEN dept_avg > comp_avg then 'higher' WHEN dept_avg < comp_avg then 'lower' ELSE 'same' END AS comparison FROM cte GROUP BY 1,2
WITH CTE AS( SELECT ID,S.EMPLOYEE_ID,AMOUNT,PAY_DATE,DEPARTMENT_ID,AVG(AMOUNT) OVER(PARTITION BY PAY_DATE) AS COM_AVG, AVG(AMOUNT) OVER(PARTITION BY PAY_DATE,DEPARTMENT_ID) AS D_AVG FROM SALARY S LEFT JOIN EMPLOYEE E ON S.EMPLOYEE_ID=E.EMPLOYEE_ID ) SELECT DATE_FORMAT(PAY_DATE,'%Y-%m') AS pay_month,department_id, CASE WHEN COM_AVG<D_AVG THEN 'higher' WHEN COM_AVG>D_AVG THEN 'lower' else 'same' END AS comparison FROM CTE GROUP BY DEPARTMENT_ID,DATE_FORMAT(PAY_DATE,'%Y-%m') order by DATE_FORMAT(PAY_DATE,'%Y-%m') desc
WITH CTE1 AS( SELECT department_id, LEFT(pay_date, 7) AS pay_month, AVG(amount) OVER (Partition by LEFT(pay_date, 7), department_id) AS avg_by_dep FROM salary a JOIN employee b ON a.employee_id = b.employee_id), CTE2 AS( SELECT AVG(amount) AS comp_avg, LEFT(pay_date, 7) AS pay_month FROM salary GROUP BY pay_month) SELECT DISTINCT CTE2.pay_month, CTE1.department_id, CASE WHEN avg_by_dep > comp_avg THEN 'higher' WHEN avg_by_dep < comp_avg THEN 'lower' ELSE 'same' END AS comparison FROM CTE1 JOIN CTE2 ON CTE1.pay_month = CTE2.pay_month
WITH CompanyAverage AS (SELECT LEFT(pay_date,7) AS month ,AVG(amount) AS CmpyAvgPerMonth FROM salary GROUP BY LEFT(pay_date,7)), DepartmentAverage AS (SELECT LEFT(S.pay_date,7) AS month ,E.department_id ,AVG(amount) AS DptAvgPerMonth FROM salary S INNER JOIN employee E ON E.employee_id = S.employee_id GROUP BY LEFT(S.pay_date,7),E.department_id) SELECT DA.month AS pay_month ,DA.department_id ,CASE WHEN CA.CmpyAvgPerMonth > DA.DptAvgPerMonth THEN 'lower' WHEN CA.CmpyAvgPerMonth < DA.DptAvgPerMonth THEN 'higher' ELSE 'same' END AS comparison FROM DepartmentAverage DA INNER JOIN CompanyAverage CA ON CA.month = DA.month
WITH T AS ( SELECT a.*, LEFT(a.pay_date, 7) AS pay_month, b.department_id FROM salary a LEFT JOIN employee b ON a.employee_id = b.employee_id ) SELECT pay_month, department_id, CASE WHEN dept_avg > company_avg THEN 'higher' WHEN dept_avg < company_avg THEN 'lower' ELSE 'same' END AS comparison FROM ( SELECT DISTINCT pay_month, department_id, AVG(amount) OVER(PARTITION BY pay_month) AS company_avg, AVG(amount) OVER(PARTITION BY pay_month, department_id) AS dept_avg FROM T ORDER BY pay_month DESC, department_id ) a
WITH T AS ( SELECT a.*, LEFT(a.pay_date, 7) AS pay_month, b.department_id FROM salary a LEFT JOIN employee b ON a.employee_id = b.employee_id ), CP_AVERAGE AS ( SELECT pay_month, AVG(amount) AS cp_avg FROM T GROUP BY 1 ), DPT_AVERAGE AS ( SELECT pay_month, department_id, AVG(amount) AS dpt_avg FROM T GROUP BY 1,2 ) SELECT a.pay_month, a.department_id, CASE WHEN a.dpt_avg > b.cp_avg THEN 'higher' WHEN a.dpt_avg < b.cp_avg THEN 'lower' ELSE 'same' END AS comparison FROM DPT_AVERAGE a JOIN CP_AVERAGE b ON a.pay_month = b.pay_month ORDER BY 1 DESC, 2
WITH TEMP AS ( SELECT LEFT(a.pay_date,7) AS pay_month, b.department_id, AVG(a.amount) AS department_salary FROM salary a LEFT JOIN employee b ON a.employee_id =b.employee_id GROUP BY 1,2) SELECT d.pay_month, d.department_id, CASE WHEN d.department_salary > c.company_salary THEN "higher" WHEN d.department_salary < c.company_salary THEN "lower" ELSE "same" END AS comparison FROM TEMP d LEFT JOIN ( SELECT LEFT(pay_date,7) AS pay_month, AVG(amount) AS company_salary FROM salary GROUP BY 1) c ON d.pay_month=c.pay_month ORDER BY 1 DESC, 2 ASC
WITH TEMP AS (SELECT DISTINCT SUBSTR(S.PAY_DATE,1,7) AS PAY_MONTH, E.DEPARTMENT_ID, AVG(S.AMOUNT) OVER (PARTITION BY SUBSTR(S.PAY_DATE,1,7),E.DEPARTMENT_ID) AS DEPT_AVG, AVG(S.AMOUNT) OVER (PARTITION BY SUBSTR(S.PAY_DATE,1,7)) AS COMP_AVG FROM SALARY S, EMPLOYEE E WHERE S.EMPLOYEE_ID = E.EMPLOYEE_ID) SELECT PAY_MONTH, DEPARTMENT_ID, CASE WHEN DEPT_AVG>COMP_AVG THEN 'higher' WHEN DEPT_AVG<COMP_AVG THEN 'lower' ELSE 'same' END AS COMPARISON FROM TEMP
WITH ac AS (SELECT LEFT(pay_date,7) AS cpay_month, AVG(amount) AS avg_com FROM salary GROUP BY LEFT(pay_date,7)), ae AS (SELECT LEFT(s.pay_date,7) AS epay_month, d.department_id, AVG(s.amount) AS avg_emp FROM salary s JOIN employee d ON s.employee_id = d.employee_id GROUP BY LEFT(s.pay_date,7), d.department_id) SELECT ae.epay_month as pay_month, ae.department_id, (CASE WHEN avg_emp > avg_com THEN 'higher' WHEN avg_emp < avg_com THEN 'lower' ELSE 'same' END) as 'comparison' FROM ae JOIN ac on ae.epay_month = ac.cpay_month
WITH ave_salary AS( SELECT LEFT(pay_date,7) as dates, avg(amount) as ave_comp FROM salary GROUP BY LEFT(pay_date,7) ), ave_dep AS( SELECT department_id,avg(ifnull(amount,0)) as dep_ave,LEFT(pay_date,7) as dates FROM employee LEFT JOIN salary on employee.employee_id = salary.employee_id GROUP BY department_id,LEFT(pay_date,7) ), full_table AS( SELECT ave_salary.dates as pay_month, ave_dep.department_id as department_id,dep_ave,ave_comp FROM ave_dep LEFT JOIN ave_salary on ave_dep.dates = ave_salary.dates ) SELECT pay_month,department_id, case when dep_ave > ave_comp then 'higher' when dep_ave < ave_comp then 'lower' else 'same' end as comparison FROM full_table
WITH avg_by_dept AS ( SELECT SUBSTR(pay_date,1,7) AS pay_month, e.department_id, SUM(s.amount)/COUNT(1) AS dept_avg_per_mon FROM salary s JOIN employee e ON s.employee_id = e.employee_id GROUP BY 1,2 ), avg_by_company AS ( SELECT SUBSTR(pay_date,1,7) AS pay_month, SUM(amount)/COUNT(1) AS cmpy_avg_per_mon FROM salary GROUP BY 1 ) SELECT d.pay_month, d.department_id, CASE WHEN d.dept_avg_per_mon > c.cmpy_avg_per_mon THEN 'higher' WHEN d.dept_avg_per_mon < c.cmpy_avg_per_mon THEN 'lower' ELSE 'same' END AS comparison FROM avg_by_dept d JOIN avg_by_company c ON d.pay_month = c.pay_month
WITH avg_salary AS( SELECT DATE_FORMAT(s.pay_date, '%Y-%m') pay_month, e.department_id department_id, AVG(s.amount) OVER(PARTITION BY DATE_FORMAT(s.pay_date, '%Y-%m'), e.department_id) dept_avg, AVG(s.amount) OVER(PARTITION BY DATE_FORMAT(s.pay_date, '%Y-%m')) company_avg FROM salary s LEFT JOIN employee e ON s.employee_id = e.employee_id ) SELECT DISTINCT pay_month, department_id, CASE WHEN dept_avg > company_avg THEN 'higher' WHEN dept_avg < company_avg THEN 'lower' ELSE 'same' END AS comparison FROM avg_salary ORDER BY 1 DESC, 2 ASC
WITH combined AS ( SELECT department_id, salary.employee_id, amount, DATE_FORMAT(pay_date,'%Y-%m') AS pay_month FROM salary JOIN employee ON salary.employee_id = employee.employee_id ), department_average AS ( SELECT AVG(amount) AS department_mean, department_id, pay_month FROM combined GROUP BY department_id, pay_month ), company_average AS ( SELECT AVG(amount) AS company_mean, pay_month FROM combined GROUP BY pay_month ) SELECT department_average.pay_month, department_average.department_id, CASE WHEN department_average.department_mean > company_average.company_mean THEN 'higher' WHEN department_average.department_mean < company_average.company_mean THEN 'lower' ELSE 'same' END AS comparison FROM department_average JOIN company_average WHERE department_average.pay_month = company_average.pay_month
WITH company AS (SELECT left(pay_date,7) as pay_month, avg(amount) AS com_avg FROM salary GROUP BY pay_month), department AS (SELECT left(pay_date,7) AS pay_month, department_id, avg(amount) as dep_avg FROM salary s JOIN employee e ON s.employee_id=e.employee_id GROUP BY left(pay_date,7), department_id) SELECT d.pay_month, d.department_id, CASE WHEN d.dep_avg<c.com_avg THEN 'lower' WHEN d.dep_avg>c.com_avg THEN 'higher' ELSE 'same' END AS comparison FROM department d LEFT JOIN company c ON d.pay_month=c.pay_month
WITH company_average AS ( SELECT LEFT(pay_date, 7) AS pay_month, AVG(amount) AS amount FROM salary GROUP BY pay_month ) SELECT sub.pay_month, sub.department_id, CASE WHEN sub.department_average > ca.amount THEN 'higher' WHEN sub.department_average < ca.amount THEN 'lower' ELSE 'same' END AS comparison FROM ( SELECT LEFT(pay_date, 7) AS pay_month, e.department_id, AVG(s.amount) AS department_average FROM salary s INNER JOIN employee e ON s.employee_id = e.employee_id GROUP BY pay_month, e.department_id ) sub INNER JOIN company_average ca ON sub.pay_month = ca.pay_month
WITH company_avg_monthly AS ( SELECT EXTRACT(YEAR FROM pay_date) AS yr, EXTRACT(MONTH FROM pay_date) AS mth, AVG(AMOUNT) AS avg_comp_salary FROM salary GROUP BY EXTRACT(MONTH FROM pay_date) ORDER BY 1 ), dep_avg_monthly AS ( SELECT EXTRACT(YEAR FROM pay_date) AS yr, LPAD(EXTRACT(MONTH FROM pay_date), 2, 0) AS mth, employee.department_id, AVG(amount) AS avg_dep_salary FROM salary LEFT JOIN employee ON employee.employee_id = salary.employee_id GROUP BY EXTRACT(MONTH FROM pay_date), employee.department_id ORDER BY 1, 2 ), combined AS ( SELECT CAST(dam.yr AS CHAR) AS yr, CAST(dam.mth AS CHAR) AS mth, dam.department_id, dam.avg_dep_salary, cam.avg_comp_salary FROM dep_avg_monthly AS dam JOIN company_avg_monthly AS cam ON (dam.yr = cam.yr) AND (dam.mth = cam.mth) ) SELECT CONCAT(yr,'-', mth) AS pay_month, department_id, CASE WHEN avg_dep_salary > avg_comp_salary THEN 'higher' WHEN avg_dep_salary < avg_comp_salary THEN 'lower' ELSE 'same' END AS comparison FROM combined
WITH company_avg_salary AS ( SELECT SUBSTRING(pay_date, 1, 7) AS pay_month, AVG(amount) AS avg_salary FROM salary GROUP BY pay_month ) , department_avg_salary AS ( SELECT SUBSTRING(s.pay_date, 1, 7) AS pay_month, e.department_id, AVG(s.amount) as avg_salary FROM salary s JOIN employee e ON s.employee_id = e.employee_id GROUP BY pay_month, e.department_id ) SELECT d.pay_month, d.department_id, CASE WHEN c.avg_salary > d.avg_salary THEN 'lower' WHEN c.avg_salary = d.avg_salary THEN 'same' ELSE 'higher' END AS comparison FROM company_avg_salary c JOIN department_avg_salary d ON c.pay_month = d.pay_month
WITH dep AS (SELECT SUBSTRING(pay_date,1,7) AS pay_month,department_id,AVG(amount) AS dep_avg FROM salary JOIN employee USING(employee_id) GROUP BY SUBSTRING(pay_date,1,7),department_id), com AS (SELECT SUBSTRING(pay_date,1,7) AS pay_month,AVG(amount) AS company_avg FROM salary GROUP BY SUBSTRING(pay_date,1,7)) SELECT pay_month,department_id,(CASE WHEN dep_avg>company_avg THEN "higher" WHEN dep_avg=company_avg THEN "same" WHEN dep_avg<company_avg THEN "lower" END) AS comparison FROM dep JOIN com USING(pay_month)
