with cte as (select *, avg(amount) over(partition by pay_month) comp1, avg(amount) over(partition by department_id, pay_month) comp2 from(select s.id, s.employee_id, s.amount, date_format(s.pay_date, '%Y-%m') pay_month, e. department_id from salary s left join employee e using(employee_id)) a order by pay_month) select distinct pay_month, department_id, (case when comp2>comp1 then 'higher' when comp2 = comp1 then 'same' else 'lower' end) as comparison from cte
with cte as (select Date_format(pay_date,'%Y-%m') as pay_month,E.department_id, avg(amount) as avg_dept_salary from employee E left join salary S on S.employee_id=E.employee_id group by pay_month,department_id) , cte1 as (select Date_format(pay_date,'%Y-%m') as pay_month, avg(amount) as avg_monthly_salary from salary group by pay_month) select C.pay_month, C.department_id, Case when avg_dept_salary>avg_monthly_salary then 'higher' when avg_dept_salary<avg_monthly_salary then 'lower' else 'same' end as comparison from cte C join cte1 C1 on C.pay_month=C1.pay_month
with cte as (select date_format(pay_date,'%Y-%m') as pay_month, department_id, avg(amount) as avg_dep from salary join employee using(employee_id) group by 1,2 ), cte_1 as (select date_format(pay_date,'%Y-%m') as pay_month, avg(amount) as avg_month from salary group by 1 ) select pay_month, department_id, case when avg_dep > avg_month then 'higher' when avg_dep = avg_month then 'same' else 'lower' end as comparison from cte join cte_1 using (pay_month)
with cte as (select department_id , substring(pay_date , 1,7) as pay, Avg(amount) as tot_ave from salary join employee on salary.employee_id = employee.employee_id group by 2 order by 1 ) , cte1 as (select department_id , substring(pay_date , 1,7) as pay, Avg(amount) as ave from salary join employee on salary.employee_id = employee.employee_id group by 1, 2 order by 1 ) select cte1.pay as pay_month , cte1.department_id , (if (tot_ave > ave , 'lower' , if(tot_ave < ave , 'higher' , 'same'))) comparison from cte join cte1 on cte.pay = cte1.pay
with cte as (select department_id, amount, date_format(pay_date, '%Y-%m') as pay_month from salary join employee using (employee_id)) select dep.pay_month, dep.department_id, case when department < company then 'lower' when department = company then 'same' when department > company then 'higher' end as comparison from( select pay_month, department_id,avg(amount) as department from cte group by pay_month, department_id) dep join (select pay_month, department_id, avg(amount) as company from cte group by pay_month) com on dep.pay_month = com.pay_month
with cte as (select department_id, date_format(pay_date, '%Y-%m') as pay_month, avg(amount) over(partition by pay_date, department_id) as dept_avg, avg(amount) over(partition by pay_date) as company_avg from salary s join employee e on s.employee_id = e.employee_id ) select distinct pay_month, department_id, (case when dept_avg>company_avg then 'higher' when dept_avg<company_avg then 'lower' else 'same' end) as comparison from cte order by pay_month desc, department_id
with cte as (select left(pay_date, 7) as pay_month, department_id, avg(amount) over (partition by left(pay_date, 7), department_id) as avg_dep, avg(amount) over (partition by left(pay_date, 7)) as avg_comp from salary s join employee e on s.employee_id = e.employee_id) select distinct(pay_month), department_id, (case when avg_dep>avg_comp then "higher" when avg_dep<avg_comp then "lower" else "same" end) as comparison from cte
with cte as (select left(pay_date,7) as month, avg(amount) as company_avg from salary group by month(pay_date)), cte2 as (select left(pay_date,7) as month, e.department_id, avg(amount) as department_avg from employee e join salary s using(employee_id) group by left(pay_date,7), e.department_id) select month as pay_month, department_id, (case when department_avg > company_avg then 'higher' when department_avg < company_avg then 'lower' else 'same' end) as comparison from cte join cte2 using(month)
with cte as( select left(pay_date,7) as month,round(avg(amount),2) as avg_Cmp from salary group by 1 ) select left(pay_date,7) as pay_month, department_id, case when round(avg(s.amount),2) > (select avg_Cmp from cte where month = left(s.pay_date,7)) then 'higher' when round(avg(s.amount),2) < (select avg_Cmp from cte where month = left(s.pay_date,7)) then 'lower' else 'same' end as comparison from salary s join employee e on s.employee_id = e.employee_id group by 1,2 order by 1 desc, 2 asc
with cte as( select s.employee_id, amount, pay_date, e.department_id, avg(amount) as department_avg from salary s left join employee e on s.employee_id = e.employee_id group by e.department_id, month(pay_date) ), cte2 as ( select pay_date,avg(amount) as cmp_avg from salary group by month(pay_date) ) select substring(cte.pay_date,1,7) as pay_month, department_id, (case when department_avg>cmp_avg then 'higher' when department_avg<cmp_avg then 'lower' else 'same' end) comparison from cte left join cte2 on cte.pay_date = cte2.pay_date
with cte1 as ( select left(s.pay_date,7) as pay_date, e.department_id, avg(amount) as avg_dept_amount from salary s left join employee e on e.employee_id = s.employee_id group by left(s.pay_date,7), e.department_id ) , cte2 as ( select left(s.pay_date,7) as pay_date, avg(amount) as avg_month_amount from salary s group by left(s.pay_date,7) ) select c1.pay_date as pay_month, c1.department_id, case when c1.avg_dept_amount - c2.avg_month_amount > 0 then "higher" when c1.avg_dept_amount - c2.avg_month_amount < 0 then "lower" else "same" end as comparison from cte1 c1 left join cte2 c2 on c1.pay_date = c2.pay_date
with cte1 as (select date_format(b.pay_date, '%Y-%m') as pay_month, a.department_id, ifnull(avg(amount), 0) as average from employee a left join salary b on a.employee_id = b.employee_id group by 1, 2), cte2 as (select date_format(pay_date, '%Y-%m') as pay_month, avg(amount) as average from salary group by 1) select cte1.pay_month, cte1.department_id, case when cte1.average > cte2.average then 'higher' when cte1.average = cte2.average then 'same' else 'lower' end as comparison from cte1 join cte2 on cte1.pay_month = cte2.pay_month
with cte1 as (select date_format(pay_date, '%Y-%m') as mnth, avg(amount) as mnth_avg from salary group by mnth), cte2 as (select date_format(s.pay_date, '%Y-%m') as pay_month, e.department_id, avg(s.amount) as amt from salary s join employee e on s.employee_id = e.employee_id group by pay_month, e.department_id) select c2.pay_month, c2.department_id, case when c2.amt > c1.mnth_avg then 'higher' when c2.amt < c1.mnth_avg then 'lower' else 'same' end as comparison from cte1 c1 join cte2 c2 on c1.mnth = c2.pay_month
with cte1 as (select date_format(pay_date, '%Y-%m') as pay_month, avg(amount) as month_avg from salary group by pay_month), cte2 as (select date_format(s.pay_date, '%Y-%m') as pay_month, e.department_id, avg(s.amount) as dept_avg from salary s join employee e on s.employee_id = e.employee_id group by pay_month, e.department_id) select c2.pay_month, c2.department_id, case when c2.dept_avg > c1.month_avg then 'higher' when c2.dept_avg < c1.month_avg then 'lower' else 'same' end as comparison from cte1 c1 join cte2 c2 on c1.pay_month = c2.pay_month
with cte1 as( select avg(amount) as firm_avg, date_format(pay_date, '%Y-%m' ) as pay_month from salary group by date_format(pay_date, '%Y-%m' ) ) ,cte2 as( select e.department_id,date_format(s.pay_date, '%Y-%m' ) as pay_month,avg(amount) as pay from salary s join employee e on s.employee_id = e.employee_id group by e.department_id, date_format(s.pay_date, '%Y-%m' ) ) select c2.pay_month, c2.department_id, case when c2.pay > c1.firm_avg then 'higher' when c2.pay < c1.firm_avg then 'lower' else 'same' end as 'comparison' from cte2 c2 join cte1 c1 on c1.pay_month = c2.pay_month
with cte1 as(select s.id, s.employee_id, s.amount, s.pay_date, e.department_id from salary s join employee e on s.employee_id=e.employee_id) select distinct pay_month, department_id, (case when avg_department>avg_company then 'higher'when avg_department=avg_company then'same' else 'lower'end)as comparison from (select left(pay_date,7)as pay_month,avg(amount)over(partition by left(pay_date,7))as avg_company,department_id, avg(amount)over(partition by left(pay_date,7),department_id)as avg_department from cte1 )cte2 order by pay_month desc
with cte_avgs as ( select distinct e.department_id, s.pay_date, avg(amount) over (partition by pay_date) as avg_company_salary, avg(amount) over (partition by pay_date, department_id) as avg_department_salary from salary s left join employee e on e.employee_id = s.employee_id ) select distinct date_format(pay_date,'%Y-%m') as pay_month, department_id, case when avg_department_salary > avg_company_salary then 'higher' when avg_department_salary < avg_company_salary then 'lower' else 'same' end as comparison from cte_avgs order by department_id, pay_month
with cte_office as ( select concat(year(pay_date),"-",if(length(month(pay_date))<2,concat("0",month(pay_date)),month(pay_date))) 'pay_month', round(avg(amount),2) 'office_salary' from salary group by concat(year(pay_date),"-",if(length(month(pay_date))<2,concat("0",month(pay_date)),month(pay_date))) ), cte_department as ( select concat(year(pay_date),"-",if(length(month(pay_date))<2,concat("0",month(pay_date)),month(pay_date))) 'pay_month', E.department_id, round(avg(amount),2) 'dept_salary' from salary S left join employee E on S.employee_id = E.employee_id group by E.department_id, concat(year(pay_date),"-",if(length(month(pay_date))<2,concat("0",month(pay_date)),month(pay_date))) ) select A.pay_month, A.department_id, case when A.dept_salary > B.office_salary then 'higher' when A.dept_salary < B.office_salary then 'lower' else 'same' end 'comparison' from cte_department A right join cte_office B on A.pay_month = B.pay_month where A.department_id is not null order by A.pay_month desc, A.department_id
with cte_window as ( select left(pay_date, 7) as pay_month, department_id, avg(amount) over ( partition by left(pay_date, 7) ) as co_avg_monthly_salary, avg(amount) over ( partition by left(pay_date, 7), department_id ) as dept_avg_monthly_salary from salary as s join employee as e on s.employee_id = e.employee_id ), cte_assemble as ( select pay_month, department_id, case when any_value(co_avg_monthly_salary) > any_value(dept_avg_monthly_salary) then 'lower' when any_value(co_avg_monthly_salary) < any_value(dept_avg_monthly_salary) then 'higher' else 'same' end as comparison from cte_window group by 1, 2 ) select * from cte_assemble
with d as ( select DATE_FORMAT(pay_date, '%Y-%m') pay_month, department_id, avg(amount) dept_avg from salary s left join employee e on s.employee_id = e.employee_id group by 1,2 ), c as ( select DATE_FORMAT(pay_date, '%Y-%m') pay_month, avg(amount) comp_avg from salary group by 1 ) select d.pay_month, department_id, case when dept_avg > comp_avg then 'higher' when dept_avg < comp_avg then 'lower' else 'same' end comparison from d join c on d.pay_month = c.pay_month
with d as ( select department_id, date_format(pay_date,'%Y-%m') as mon, avg(amount) as salary from salary s join employee d on s.employee_id = d.employee_id group by 1,2 ), c as ( select date_format(pay_date,'%Y-%m') as mon, avg(amount) as salary from salary group by 1 ) select d.mon as pay_month,d.department_id, (case when d.salary > c.salary then 'higher' when d.salary < c.salary then 'lower' else 'same' end) as comparison from d join c on d.mon = c.mon
with d as (select substr(pay_date,1,7) as pay_month,department_id,avg(amount) as avg_s from salary s join employee e on s.employee_id = e.employee_id group by department_id, substr(pay_date,1,7) ), t as ( select substr(pay_date,1,7) as pay_month, avg(amount) as avg_t from salary group by substr(pay_date,1,7) ) select d.pay_month, department_id, case when avg_t<avg_s then 'higher' when avg_t>avg_s then 'lower' else 'same' end as comparison from d join t on d.pay_month = t.pay_month order by pay_month desc,department_id asc
with date_avg as ( select date_format(pay_date,'%Y-%m') year_mon, avg(amount) avg_mon from salary group by year_mon ), com_avg as ( select date_format(pay_date,'%Y-%m') year_mon, department_id, avg(amount) avg_mon from salary, employee where salary.employee_id = employee.employee_id group by employee.department_id, year_mon ) select com_avg.year_mon pay_month, com_avg.department_id department_id, case when com_avg.avg_mon > date_avg.avg_mon then 'higher' when com_avg.avg_mon = date_avg.avg_mon then 'same' else 'lower' end comparison from com_avg, date_avg where com_avg.year_mon = date_avg.year_mon
with dep_salary as (SELECT date_format(s.pay_date,'%Y-%m') as pay_month, e.department_id, AVG(amount) as avg_dep FROM salary s JOIN employee e ON s.employee_id = e.employee_id GROUP BY pay_month, e.department_id) , company as ( SELECT date_format(pay_date,'%Y-%m') as pay_month, AVG(amount) as avg_com FROM salary GROUP BY pay_month ) SELECT d.pay_month, d.department_id, CASE WHEN avg_dep > avg_com THEN 'higher' WHEN avg_dep < avg_com THEN 'lower' ELSE 'same' END AS comparison FROM dep_salary d JOIN company c ON d.pay_month = c.pay_month
with department_avg as ( (select e1.department_id, date_format(pay_date, '%Y-%m') as pay_month, avg(s1.amount) as pay_avg from salary s1 join employee e1 on s1.employee_id = e1.employee_id group by year(pay_date), month(pay_date), e1.department_id)), company_avg as (select date_format(pay_date, '%Y-%m') as pay_month, avg(s2.amount) as pay_avg from salary s2 join employee e2 on s2.employee_id = e2.employee_id group by year(pay_date), month(pay_date)) select department_avg.department_id, department_avg.pay_month, (case when department_avg.pay_avg >company_avg.pay_avg then 'higher' when department_avg.pay_avg = company_avg.pay_avg then 'same' else 'lower' end ) as comparison from department_avg join company_avg on department_avg.pay_month = company_avg.pay_month
with department_salary as (select department_id , date_format(pay_date, '%Y-%m') as pay_month , avg(amount) as dept_avg from salary left join employee on salary.employee_id = employee.employee_id group by department_id, pay_month), company_salary as (select date_format(pay_date, '%Y-%m') as pay_month , avg(amount) as company_avg from salary group by pay_month) select a.pay_month as pay_month, department_id , case when dept_avg < company_avg then 'lower' when dept_avg > company_avg then 'higher' when dept_avg = company_avg then 'same' end as comparison from department_salary a join company_salary b on a.pay_month = b.pay_month
with depavg as( select pay_date,department_id, avg(amount) as dep from employee e join salary s on s.employee_id = e.employee_id group by pay_date,department_id), comavg as( select pay_date, avg(amount) as com from employee e join salary s on s.employee_id = e.employee_id group by pay_date ) select distinct left(c.pay_date,7) as pay_month, department_id, case when dep>com then 'higher' when dep = com then 'same' else 'lower' end as comparison from depavg d join comavg c on c.pay_date = d.pay_date
with dept as (Select substring(pay_date,1,7) as pay_month, b.department_id,avg(a.amount) as avg_salary_dep from salary a left join employee b on a.employee_id=b.employee_id group by 1,2), comp as (Select substring(pay_date,1,7) as pay_month, avg(amount) as avg_salary_comp from salary group by substring(pay_date,1,7)) Select a.pay_month, a.department_id, case when a.avg_salary_dep>b.avg_salary_comp then 'higher' when a.avg_salary_dep<b.avg_salary_comp then 'lower' else 'same' end as comparison from dept a left join comp b on a.pay_month=b.pay_month
with dept_salary as (select department_id,date_format(pay_date,'%Y-%m') as pay_month , avg(amount) as dep_avg from salary s JOIN employee e ON s.employee_id = e.employee_id GROUP BY 1, 2), cmp_salary as (select date_format(pay_date,'%Y-%m') as pay_month , avg(amount) as cmp_avg from salary group by 1) SELECT ds.pay_month, ds.department_id, CASE WHEN dep_avg>cmp_avg THEN 'higher' WHEN dep_avg=cmp_avg THEN 'same' ELSE 'lower' END AS comparison from dept_salary ds join cmp_salary cs on ds.pay_month=cs.pay_month
with deptavg as ( select e.department_id, avg(amount) totalmonthlydeptamount, (pay_date) month from salary s join employee e on s.employee_id=e.employee_id group by department_id,month(pay_date) ), totavg as( select avg(amount) totalmonthlyamount, max(e.employee_id) employee_id, max(pay_date) month from salary s join employee e on s.employee_id=e.employee_id group by month(pay_date) ) select DATE_FORMAT(d.month, "%Y-%m") as pay_month, d.department_id department_id, (case when d.totalmonthlydeptamount > t.totalmonthlyamount then 'higher' when d.totalmonthlydeptamount < t.totalmonthlyamount then 'lower' else 'same' end) comparison from deptavg d left join totavg t on d.month=t.month order by pay_month desc,department_id
with ds as( select e.department_id, s.amount, date_format(s.pay_date, '%Y-%m') pay_month from salary s left join employee e on s.employee_id = e.employee_id), ds_avg as (select pay_month,department_id, avg(amount) d_avg from ds group by 1,2), c_avg as (select pay_month,avg(amount) c_avg from ds group by 1) select d.pay_month, d.department_id, case when d_avg > c_avg then 'higher' when d_avg < c_avg then 'lower' else 'same' end comparison from ds_avg d left join c_avg c on d.pay_month = c.pay_month
with merge as (select s.*, department_id,left(pay_date,7) as month from salary s join employee e on s.employee_id = e.employee_id), t1 as (select month, avg(amount) as c_avg from merge group by month), t2 as (select department_id,month,avg(amount) as d_avg from merge group by month,department_id) select t2.month pay_month, department_id, case when d_avg>c_avg then 'higher' when d_avg=c_avg then 'same' else 'lower' end as comparison from t2 left join t1 on t2.month = t1.month
with month_avg as ( SELECT DATE_FORMAT(pay_date, "%Y-%m") as pay_month,avg(amount) as co_avg from salary group by DATE_FORMAT(pay_date, "%Y-%m") ), department_avg as ( select DATE_FORMAT(pay_date, "%Y-%m") as pay_month ,e.department_id, avg(s.amount) as dpt_avg from salary s left join employee e on s.employee_id = e.employee_id group by DATE_FORMAT(pay_date, "%Y-%m"),e.department_id ) select d.pay_month, department_id, case when co_avg>dpt_avg then 'lower' when co_avg < dpt_avg then 'higher' else 'same' end as comparison from month_avg m inner join department_avg d on m.pay_month = d.pay_month
with monthly_averages as ( select pay_date, avg(amount) as avg_salary from salary group by pay_date ) , department_monthly_average as ( select s.pay_date, e.department_id, avg(s.amount) as avg_salary from salary s inner join employee e on e.employee_id = s.employee_id group by s.pay_date, e.department_id ) select distinct substr(d.pay_date,1,7) as pay_month, d.department_id, case when d.avg_salary > m.avg_salary then 'higher' when d.avg_salary < m.avg_salary then 'lower' else 'same' end as comparison from department_monthly_average d inner join monthly_averages m on d.pay_date = m.pay_date
with monthly_avg as (select substr(a.pay_date, 1, 7) as mnth, b.department_id, avg(amount) as avg_salary from salary a left join employee b on a.employee_id = b.employee_id group by 1, 2), company_avg as (select substr(pay_date, 1, 7) as mnth, avg(amount) as avg_comp_salary from salary group by 1 ) select a.mnth as pay_month, a.department_id, case when a.avg_salary >b.avg_comp_salary then 'higher' when a.avg_salary = b.avg_comp_salary then 'same' else 'lower' end as comparison from monthly_avg as a left join company_avg as b on a.mnth = b.mnth
with monthly_data as ( select date_format(pay_date,'%Y-%m') as pay_month , e.department_id as department_id , avg(amount) over(partition by extract(year_month from pay_date)) as company_avg , avg(amount) over(partition by e.department_id, extract(year_month from pay_date)) as dept_avg from salary s join employee e on e.employee_id=s.employee_id ) select pay_month , department_id , case when dept_avg=company_avg then 'same' when dept_avg>company_avg then 'higher' when dept_avg<company_avg then 'lower' end as comparison from monthly_data group by 1,2
with overall as ( select date_format(pay_date, '%Y-%m') as pay_month , avg(amount) as overall_avg from Salary group by pay_month ) , dept as ( select e.department_id , date_format(s.pay_date, '%Y-%m') as pay_month , avg(s.amount) as dept_avg from Salary as s join employee as e on s.employee_id = e.employee_id group by e.department_id , pay_month ) select d.pay_month , d.department_id , case when d.dept_avg>o.overall_avg then 'higher' when d.dept_avg=o.overall_avg then "same" else "lower" end as comparison from dept as d join overall as o on d.pay_month = o.pay_month order by d.pay_month desc , d.department_id
with sal_dep as ( select DATE_FORMAT(S.pay_date, '%Y-%m') as pay_month, E.department_id, sum(S.amount) as department_salary, count(S.amount) as department_count from salary S join employee E on S.employee_id = E.employee_id group by pay_month, E.department_id ) select pay_month, department_id, Case when department_avg > company_avg then 'higher' when department_avg < company_avg then 'lower' else 'same' end as comparison from (select A.pay_month, B.department_id, A.company_avg, B.department_avg from ( select pay_month, sum(department_salary)/sum(department_count) as company_avg from sal_dep group by pay_month) A right join ( select pay_month, department_id, sum(department_salary)/sum(department_count) as department_avg from sal_dep group by pay_month, department_id ) B on A.pay_month = B.pay_month) Z
with sub as( select s.employee_id, department_id, amount, date_format(pay_date, "%Y-%m") as pay_month from salary s join employee e on s.employee_id = e.employee_id ), comp as( select s1.pay_month, department_id, comp_avg, dept_avg from( select pay_month, avg(amount) as comp_avg from sub group by pay_month ) s1 join (select pay_month, department_id, avg(amount) as dept_avg from sub group by pay_month, department_id ) s2 on s1.pay_month = s2.pay_month group by 1,2 ) select pay_month, department_id, case when dept_avg > comp_avg then "higher" when dept_avg < comp_avg then "lower" else "same" end comparison from comp
with t AS( SELECT s.employee_id, s.amount, LEFT(s.pay_date,7) pay_month, e.department_id FROM salary s JOIN employee e ON s.employee_id = e.employee_id ) SELECT pay_month, department_id, CASE WHEN avg > avg2 THEN 'higher' WHEN avg = avg2 THEN 'same' ELSE 'lower' END comparison FROM ( SELECT pay_month, department_id, amount, AVG(amount) OVER (PARTITION BY pay_month, department_id ) avg, AVG(amount) OVER (PARTITION BY pay_month) avg2 FROM t ) t2 GROUP BY pay_month, department_id
with t as ( select LEFT(pay_date,7) as pay_month ,e.department_id ,AVG(amount) over(partition by LEFT(pay_date,7)) as co_sal ,AVG(amount) over(partition by LEFT(pay_date,7),e.department_id) as dept_sal from employee e LEFT JOIN salary s on e.employee_id = s.employee_id ) select distinct pay_month ,department_id ,case when dept_sal < co_sal then 'lower' when dept_sal > co_sal then 'higher' when dept_sal = co_sal then 'same' end as comparison from t
with t as ( select avg(s.amount)as avg_month_salary, date_format(s.pay_date, '%Y-%m')as avg_year_month from salary s group by 2 ), t2 as ( select avg(s.amount) as avg_dept_month_salary, e.department_id, date_format(s.pay_date, '%Y-%m') as avg_year_month_dept from salary s join employee e on s.employee_id = e.employee_id group by 2,3) select t2.avg_year_month_dept as pay_month, t2.department_id, case when t2.avg_dept_month_salary > t.avg_month_salary then 'higher' when t2.avg_dept_month_salary < t.avg_month_salary then 'lower' else 'same' end as comparison from t join t2 on t.avg_year_month = t2.avg_year_month_dept
with t as (select Distinct date_format(pay_date,'%Y-%m') pay_month, department_id, avg(amount) over(partition by date_format(pay_date,'%Y-%m')) com, avg(amount) over(partition by date_format(pay_date,'%Y-%m'),department_id) dept from salary join employee using(employee_id)) select pay_month, department_id, case when dept> com then 'higher' when dept < com then 'lower' else 'same' end as comparison from t
with t1 as ( select date_format(pay_date, '%Y-%m') as pay_month, avg(amount) as cmpy_avg from salary group by pay_month), t2 as ( select date_format(pay_date, '%Y-%m') as pay_month, e.department_id, avg(amount) as dpt_avg from salary s join employee e on s.employee_id = e.employee_id group by e.department_id, pay_month) select t2.pay_month, department_id, if(cmpy_avg = dpt_avg, 'same', if(dpt_avg > cmpy_avg, 'higher', 'lower')) as comparison from t2 left join t1 on t1.pay_month = t2.pay_month order by t2.department_id asc, t2.pay_month desc
with t1 as ( select date_format(pay_date, '%Y-%m') pay_month, department_id, amount from salary a join employee b on a.employee_id = b.employee_id ) select distinct pay_month, department_id, case when (avg(amount) over (partition by pay_month, department_id)) > avg(amount) over (partition by pay_month) then 'higher' when (avg(amount) over (partition by pay_month, department_id)) < avg(amount) over (partition by pay_month) then 'lower' else 'same' end comparison from t1 order by pay_month desc, department_id
with t1 as ( select department_id,a.employee_id, amount, left(pay_date,7) as pay_month, avg(amount) as com_avg from salary a right join employee using(employee_id) group by 4), t2 as ( select department_id,a.employee_id, amount, left(pay_date,7) as pay_month, avg(amount) as dep_avg from salary a right join employee using(employee_id) group by 1,4) select t2.pay_month, t2.department_id, case when dep_avg>com_avg then 'higher' when dep_avg<com_avg then 'lower' else 'same' end as comparison from t2 left join t1 on t1.pay_month=t2.pay_month
