WITH dep_cum_salary AS ( SELECT DATE_FORMAT(s.pay_date,'%Y-%m') as pay_month, e.department_id , SUM(s.amount) dep_salary , count(s.amount) dep_count FROM salary as s JOIN employee as e ON s.employee_id = e.employee_id GROUP BY pay_month, e.department_id ), avg_salary AS ( SELECT pay_month,department_id, dep_salary/dep_count dep_avg_salary, SUM(dep_salary) OVER (PARTITION BY pay_month)/SUM(dep_count) OVER (PARTITION BY pay_month) as comp_avg_salary FROM dep_cum_salary) SELECT pay_month, department_id , (CASE WHEN dep_avg_salary>comp_avg_salary THEN 'higher' WHEN dep_avg_salary<comp_avg_salary THEN 'lower' ELSE 'same' END)comparison FROM avg_salary
WITH depart_combine AS ( SELECT s.pay_date , s.amount , e.department_id FROM salary s JOIN employee e ON s.employee_id = e.employee_id ), month_avg AS ( SELECT DATE_FORMAT(pay_date, '%Y-%m') as month ,AVG(amount) as comp_avg FROM depart_combine GROUP BY 1 ), depart_avg AS ( SELECT DATE_FORMAT(pay_date, '%Y-%m') as month ,department_id ,AVG(amount) as depart_avg FROM depart_combine GROUP BY 1,2 ) SELECT da.month AS pay_month ,da.department_id ,CASE WHEN depart_avg < comp_avg THEN 'lower' WHEN depart_avg > comp_avg THEN 'higher' ELSE 'same' END AS comparison FROM depart_avg da JOIN month_avg ma ON da.month = ma.month
WITH dept AS (SELECT SUBSTRING(pay_date, 1,7) AS PAY_MONTH, department_id, AVG(amount) AS dept_amount from salary INNER JOIN employee USING(employee_id) GROUP BY 1,2), comp AS (SELECT SUBSTRING(pay_date, 1,7) AS PAY_MONTH, AVG(amount) AS comp_amount from salary INNER JOIN employee USING(employee_id) GROUP BY 1) SELECT PAY_MONTH AS pay_month, department_id, CASE WHEN dept_amount > (SELECT comp_amount FROM comp WHERE comp.PAY_MONTH = dept.PAY_MONTH) THEN 'higher' WHEN dept_amount = (SELECT comp_amount FROM comp WHERE comp.PAY_MONTH = dept.PAY_MONTH) THEN 'same' ELSE 'lower' END AS comparison FROM dept
WITH dept_avg AS ( SELECT s.amount, s.pay_date, e.department_id, AVG(s.amount) AS 'avg' FROM salary AS s LEFT JOIN employee AS e ON s.employee_id = e.employee_id GROUP BY MONTH(s.pay_date), e.department_id ), comp_avg AS ( SELECT s.amount, s.pay_date, e.department_id, AVG(s.amount) AS 'avg' FROM salary AS s LEFT JOIN employee AS e ON s.employee_id = e.employee_id GROUP BY MONTH(s.pay_date) ) SELECT SUBSTRING(d.pay_date, 1, 7) AS 'pay_month', d.department_id, CASE WHEN d.avg > c.avg THEN 'higher' WHEN d.avg < c.avg THEN 'lower' ELSE 'same' END AS 'comparison' FROM dept_avg AS d LEFT JOIN comp_avg AS c ON MONTH(d.pay_date) = MONTH(c.pay_date)
WITH emp_salary AS ( SELECT e.employee_id, department_id, amount, DATE_FORMAT(pay_date, "%Y-%m") AS pay_month FROM employee e JOIN salary s ON e.employee_id=s.employee_id ), comp_avg_salary AS ( SELECT pay_month, AVG(amount) as avg_salary FROM emp_salary GROUP BY pay_month ), department_avg_salary AS ( SELECT pay_month, department_id, AVG(amount) as avg_salary FROM emp_salary GROUP BY pay_month, department_id ) SELECT cas.pay_month, department_id, CASE WHEN cas.avg_salary = das.avg_salary THEN 'same' WHEN cas.avg_salary > das.avg_salary THEN 'lower' ELSE 'higher' END as comparison FROM department_avg_salary das JOIN comp_avg_salary cas ON das.pay_month = cas.pay_month
WITH full_table AS (SELECT s.employee_id, amount, DATE_FORMAT(pay_date,'%Y-%m') AS pay_month, department_id FROM salary s LEFT JOIN employee e ON s.employee_id = e.employee_id) SELECT DISTINCT pay_month, department_id, CASE WHEN d_avg = c_avg THEN 'same' WHEN d_avg < c_avg THEN 'lower' ELSE 'higher' END AS comparison FROM (SELECT pay_month, department_id, AVG(amount) OVER(PARTITION BY pay_month, department_id) AS d_avg, AVG(amount) OVER(PARTITION BY pay_month) AS c_avg FROM full_table) a ORDER BY pay_month DESC, department_id
WITH joined AS( SELECT s.employee_id, DATE_FORMAT(pay_date, '%Y-%m') AS pay_month, amount, department_id FROM salary s LEFT JOIN employee e ON s.employee_id = e.employee_id), company_avg AS ( SELECT pay_month, AVG(amount) AS average_salary FROM joined GROUP BY pay_month), avg_pay_department AS( SELECT pay_month,department_id, AVG(amount) AS department_average_salary FROM joined GROUP BY pay_month,department_id) SELECT apd.pay_month, apd.department_id, CASE WHEN department_average_salary < average_salary THEN "lower" WHEN department_average_salary > average_salary THEN "higher" ELSE "same" END comparison FROM avg_pay_department apd LEFT JOIN company_avg ca ON apd.pay_month = ca.pay_month
WITH monthly_avgs AS ( SELECT DISTINCT LEFT(s.pay_date,7) AS pay_month, e.department_id, AVG(s.amount) OVER (PARTITION BY MONTH(s.pay_date), e.department_id) AS dept_avg, AVG(s.amount) OVER (PARTITION BY MONTH(s.pay_date)) AS company_avg FROM salary s LEFT JOIN employee e ON s.employee_id = e.employee_id ) SELECT pay_month, department_id, CASE WHEN dept_avg < company_avg THEN 'lower' WHEN dept_avg = company_avg THEN 'same' WHEN dept_avg > company_avg THEN 'higher' END AS comparison FROM monthly_avgs ORDER BY pay_month DESC, department_id
WITH monthly_dept_salary AS ( SELECT SUBSTR(s.pay_date, 1, 7) AS pay_month, e.department_id, AVG(amount) AS avg_amount FROM employee AS e INNER JOIN salary AS s ON e.employee_id = s.employee_id GROUP BY e.department_id, SUBSTR(s.pay_date, 1, 7) ), monthly_salary AS ( SELECT SUBSTR(s.pay_date, 1, 7) AS pay_month, AVG(amount) AS avg_amount FROM employee AS e INNER JOIN salary AS s ON e.employee_id = s.employee_id GROUP BY SUBSTR(s.pay_date, 1, 7) ) SELECT mds.pay_month, department_id, CASE WHEN mds.avg_amount > ms.avg_amount THEN 'higher' WHEN mds.avg_amount < ms.avg_amount THEN 'lower' ELSE 'same' END AS comparison FROM monthly_dept_salary AS mds INNER JOIN monthly_salary AS ms ON mds.pay_month = ms.pay_month
WITH salarytable AS( SELECT s.employee_id, e.department_id, date_format(pay_date, "%Y-%m") as pay_month, s.amount as amount FROM salary as s JOIN employee as e using (employee_id) ) SELECT distinct pay_month, department_id, CASE WHEN avgsalary_dept>avgsalary_comp THEN "higher" WHEN avgsalary_dept<avgsalary_comp THEN "lower" ELSE "same" END as comparison FROM( select distinct department_id, pay_month, AVG(amount)OVER(PARTITION By pay_month,department_id) as avgsalary_dept, AVG(amount)OVER(PARTITION By pay_month) as avgsalary_comp FROM salarytable )a
WITH t1 AS ( SELECT LEFT(pay_date, 7) AS pay_month, e.department_id, AVG(amount) AS avg_amount_dept FROM salary s JOIN employee e ON s.employee_id = e.employee_id GROUP BY pay_month, e.department_id ), t2 AS ( SELECT LEFT(pay_date, 7) AS pay_month, AVG(amount) AS avg_amount FROM salary s JOIN employee e ON s.employee_id = e.employee_id GROUP BY pay_month ) SELECT t1.pay_month, t1.department_id, CASE WHEN t1.avg_amount_dept < t2.avg_amount THEN 'lower' WHEN t1.avg_amount_dept > t2.avg_amount THEN 'higher' ELSE 'same' END AS comparison FROM t1 JOIN t2 ON t1.pay_month = t2.pay_month
WITH t1 AS ( SELECT pay_month, department_id, AVG(amount) OVER(PARTITION BY pay_month, department_id) dept_avg, AVG(amount) OVER(PARTITION BY pay_month) com_avg FROM ( SELECT DATE_FORMAT(pay_date, '%Y-%m') pay_month, s.employee_id, amount, department_id FROM salary s LEFT JOIN employee e ON s.employee_id = e.employee_id ) t ) SELECT DISTINCT pay_month, department_id, CASE WHEN dept_avg > com_avg THEN 'higher' WHEN dept_avg = com_avg THEN 'same' WHEN dept_avg < com_avg THEN 'lower' END AS comparison FROM t1 ORDER BY pay_month DESC
WITH t1 AS (SELECT salary.*,employee.department_id FROM salary LEFT JOIN employee ON salary.employee_id = employee.employee_id), t2 AS (SELECT department_id,SUBSTRING(pay_date,1,7) AS pay_month,AVG(amount) as money FROM t1 GROUP BY department_id,SUBSTRING(pay_date,1,7)), t3 AS (SELECT SUBSTRING(pay_date,1,7) AS pay_month,AVG(amount) as money FROM t1 GROUP BY SUBSTRING(pay_date,1,7)) SELECT t2.pay_month,t2.department_id,CASE WHEN t2.money > t3.money THEN 'higher' WHEN t2.money < t3.money THEN 'lower' ELSE 'same' END AS comparison FROM t2 LEFT JOIN t3 ON t2.pay_month = t3.pay_month
WITH t1 AS (SELECT t2.employee_id, amount, pay_date, department_id, DATE_FORMAT(pay_date, '%Y-%m') AS pay_month, AVG(amount) OVER(PARTITION BY t2.pay_date) AS company_avg_salary, AVG(amount) OVER(PARTITION BY t2.pay_date, t3.department_id) AS department_avg_salary FROM salary AS t2 INNER JOIN employee AS t3 ON t2.employee_id = t3.employee_id) SELECT DISTINCT pay_month, department_id, (CASE WHEN department_avg_salary > company_avg_salary THEN 'higher' WHEN department_avg_salary < company_avg_salary THEN 'lower' WHEN department_avg_salary = company_avg_salary THEN 'same' END) AS comparison FROM t1
WITH table1 AS( SELECT employee_id, department_id, amount, DATE_FORMAT(pay_date, '%Y-%m') AS pay_month FROM salary s INNER JOIN employee e USING(employee_id) ), table2 AS( SELECT DISTINCT pay_month, department_id, AVG(amount)OVER(PARTITION BY pay_month, department_id) AS avg_dept FROM table1 ), table3 AS( SELECT DATE_FORMAT(pay_date,'%Y-%m') AS pay_month, AVG(amount) AS avg_comp FROM salary GROUP BY pay_month ) SELECT pay_month, department_id, (CASE WHEN avg_dept > avg_comp THEN 'higher' WHEN avg_dept = avg_comp THEN 'same' ELSE 'lower' END) AS comparison FROM table2 INNER JOIN table3 USING(pay_month)
WITH tmp AS ( SELECT id, employee_id, amount, pay_date, DATE_FORMAT(pay_date, '%Y-%m') AS pay_month FROM salary ) SELECT DISTINCT a.pay_month, a.department_id, (CASE WHEN a.depart_avg > a.company_avg THEN 'higher' WHEN a.depart_avg < a.company_avg THEN 'lower' ELSE 'same' END) AS comparison FROM ( SELECT t.pay_month, e.department_id, AVG(t.amount) OVER (PARTITION BY t.pay_month) AS company_avg, AVG(t.amount) OVER (PARTITION BY t.pay_month, e.department_id) AS depart_avg FROM tmp t LEFT JOIN employee e ON t.employee_id=e.employee_id ) a
WITH tmp AS (SELECT s.*, e.department_id FROM salary s JOIN employee e ON s.employee_id = e.employee_id), tmp2 AS (SELECT SUBSTRING(pay_date, 1, 7) AS pay_month, AVG(amount) avg1 FROM tmp GROUP BY pay_month), tmp3 AS (SELECT SUBSTRING(pay_date, 1, 7) AS pay_month, department_id, AVG(amount) avg2 FROM tmp GROUP BY pay_month, department_id) SELECT t3.pay_month, t3.department_id, (CASE WHEN t3.avg2 > t2.avg1 THEN 'higher' WHEN t3.avg2 = t2.avg1 THEN 'same' ELSE 'lower' END) AS 'comparison' FROM tmp3 t3 LEFT JOIN tmp2 t2 ON t3.pay_month = t2.pay_month
With Depavg_Sal as ( Select date_format(s.pay_date,'%Y-%m') pay_month, e.department_id, Avg(s.amount) Avg_Sal from salary s left join employee e on s.employee_id = e.employee_id group by 1,2 order by 1 desc,2 ), Compavg_Sal as ( Select date_format(s.pay_date,'%Y-%m') pay_month, Avg(s.amount) AvgSalc from salary s left join employee e on s.employee_id = e.employee_id group by 1 ) Select d1.pay_month, d1.department_id, CASE WHEN d1.Avg_Sal = c1.AvgSalc THEN 'same' WHEN d1.Avg_Sal > c1.AvgSalc THEN 'higher' ELSE 'lower' END AS comparison from Depavg_Sal d1 join Compavg_Sal c1 on d1.pay_month = c1.pay_month order by 1 desc,2
With company as ( Select DATE_FORMAT(pay_date,'%Y-%m') as pay_month, avg(amount) as month_avg From salary Group by DATE_FORMAT(pay_date,'%Y-%m')), department as ( Select department_id, DATE_FORMAT(pay_date,'%Y-%m') as pay_month, avg(amount) as dep_month_avg From Salary a Join Employee b on a.employee_id = b.employee_id Group by department_id, DATE_FORMAT(pay_date,'%Y-%m')) Select a.pay_month, a.department_id, case when dep_month_avg > month_avg then 'higher' when dep_month_avg = month_avg then 'same' when dep_month_avg < month_avg then 'lower' end as comparison From department a Join company b on a.pay_month = b.pay_month
With t as ( Select *,left(pay_date,7) as pay_month from salary ) Select c.pay_month,c.department_id, case when c.avg_sal > c.avg_sal_overall then 'higher' when c.avg_sal = c.avg_sal_overall then 'same' when c.avg_sal < c.avg_sal_overall then 'lower' end as comparison from ( Select b.pay_month,a.department_id,avg(b.amount) as avg_sal,(Select avg(q.amount) from t q where q.pay_month = b.pay_month group by q.pay_month ) as avg_sal_overall from (employee a) left join (t b) on a.employee_id=b.employee_id group by b.pay_month,a.department_id )c
select a.pay_month, department_id, (case when dept_avg > comp_avg then "higher" when dept_avg < comp_avg then "lower" else "same" end) as comparison from (select department_id, avg(amount) as dept_avg, date_format(pay_date, "%Y-%m") as pay_month from employee e left join salary s on e.employee_id = s.employee_id group by department_id, pay_month order by pay_month desc, department_id) a join (select avg(amount) as comp_avg, date_format(pay_date, "%Y-%m") as pay_month from salary group by pay_month) b on a.pay_month = b.pay_month
select a.pay_month,a.department_id, case when a.average<b.average then'lower' when a.average=b.average then 'same' when a.average>b.average then 'higher' end comparison from (select DATE_FORMAT(pay_date,'%Y-%m') pay_month,department_id,avg(amount) average from salary s , employee e where s.employee_id=e.employee_id group by pay_month,department_id) a join (select DATE_FORMAT(pay_date,'%Y-%m') pay_month,avg(amount) average from salary group by pay_month) b on a.pay_month=b.pay_month
select a.s as pay_month, a.department_id,(case when a.avg_de_salary < b.avg_salary then 'lower' when a.avg_de_salary > b.avg_salary then 'higher' else 'same' end) as comparison from (select Date_format(pay_date, '%Y-%m') as s, department_id, round(avg(amount),2) as avg_de_salary from salary s, employee e where s.employee_id = e.employee_id group by s, department_id) a join ( select Date_format(pay_date, '%Y-%m') as s, round(avg(amount),2) as avg_salary from salary group by s ) b on a.s = b.s
select c.pay_month, a.department_id, case when a.avg_dept_amount > c.avg_amt then "higher" when a.avg_dept_amount < c.avg_amt then "lower" else "same" end as comparison from (select avg(a.amount) avg_dept_amount, b.department_id, date_format(a.pay_date, '%Y-%m') as pay_month from salary a inner join employee b on (a.employee_id = b.employee_id) group by 2,3) as a inner join ( select avg(amount) as avg_amt, date_format(pay_date,'%Y-%m') as pay_month from ( select a.amount, a.pay_date, b.department_id from salary as a inner join employee as b on a.employee_id = b.employee_id ) ab group by 2 ) c on (a.pay_month = c.pay_month)
select c.pay_month, c.department_id, case when average_dept > average_comp then 'higher' when average_dept < average_comp then 'lower' else 'same' end comparison from ( select left(pay_date,7) pay_month, b.department_id, sum(amount)/count(*) average_dept from salary a join employee b on a.employee_id = b.employee_id group by left(pay_date,7), b.department_id ) c left join ( select left(pay_date,7) pay_month, sum(amount)/count(*) average_comp from salary group by left(pay_date,7) ) d on c.pay_month = d.pay_month
select d.pay_month, d.department_id, case when c.company_avg<d.department_avg then 'higher' when c.company_avg>d.department_avg then 'lower' else 'same' end as comparison from (select avg(amount) as company_avg, date_format(pay_date, '%Y-%m') as pay_month from salary group by date_format(pay_date, '%Y-%m')) as c join (select b.department_id, avg(amount) as department_avg, date_format(pay_date, '%Y-%m') as pay_month from salary as a left join employee as b on a.employee_id=b.employee_id group by date_format(pay_date, '%Y-%m'), department_id) as d on c.pay_month=d.pay_month order by d.pay_month, d.department_id
select d.pay_month,department_id, case when avg_department > company_avg then 'higher' when avg_department < company_avg then 'lower' else 'same' end as comparison from ( select department_id,avg(amount) as avg_department,substring(pay_date,1,7) as pay_month from salary a join employee b on a.employee_id=b.employee_id group by department_id,pay_month)d join (select avg(amount) as company_avg,substring(pay_date,1,7) as pay_month from salary group by pay_month )e on d.pay_month=e.pay_month
select da.month pay_month,department_id, case when department_average > company_average then 'higher' when department_average < company_average then 'lower' when department_average = company_average then 'same' end as comparison from (select substr(pay_date,1,7) month,department_id,avg(amount) department_average from salary join employee on salary.employee_id = employee.employee_id group by 1,2) da join (select substr(pay_date,1,7) month,avg(amount) company_average from salary group by 1) ca on da.month = ca.month
select dep.pay_month, department_id, case when dep_avg > cmp_avg then 'higher' when dep_avg < cmp_avg then 'lower' else 'same' end comparison from (select left(pay_date, 7) pay_month, department_id, avg(amount) dep_avg from salary s, employee e where s.employee_id = e.employee_id group by 1,2) dep join (select left(pay_date, 7) pay_month, avg(amount) cmp_avg from salary group by 1) cmp on dep.pay_month = cmp.pay_month
select department_salary.pay_month, department_id, case when department_avg>company_avg then 'higher' when department_avg<company_avg then 'lower' else 'same' end as comparison from ( select department_id, avg(amount) as department_avg, date_format(pay_date, '%Y-%m') as pay_month from salary join employee on salary.employee_id = employee.employee_id group by department_id, pay_month ) as department_salary join ( select avg(amount) as company_avg, date_format(pay_date, '%Y-%m') as pay_month from salary group by date_format(pay_date, '%Y-%m') ) as company_salary on department_salary.pay_month = company_salary.pay_month
select department_salary.pay_month, department_id, case when department_avg>company_avg then 'higher' when department_avg<company_avg then 'lower' else 'same' end as comparison from (select department_id, avg(amount) as department_avg, date_format(pay_date, '%Y-%m') as pay_month from salary join employee on salary.employee_id=employee.employee_id group by department_id, pay_month) as department_salary join (select avg(amount) as company_avg, date_format(pay_date, '%Y-%m') as pay_month from salary group by date_format(pay_date, '%Y-%m')) as company_salary on department_salary.pay_month=company_salary.pay_month
select dept.pay_month, department_id, case when deptAvgSal>comAvgSal then 'higher' when deptAvgSal<comAvgSal then 'lower' else 'same' end as comparison from (select DATE_FORMAT(pay_date,'%Y-%m') as pay_month, department_id, sum(s.amount)/count(*) deptAvgSal from salary s join employee e on s.employee_id=e.employee_id group by DATE_FORMAT(pay_date,'%Y%m'), department_id order by DATE_FORMAT(pay_date,'%Y%m') desc, department_id) as dept join (select DATE_FORMAT(pay_date,'%Y-%m') as pay_month, sum(s.amount)/count(*) comAvgSal from salary s join employee e on s.employee_id=e.employee_id group by DATE_FORMAT(pay_date,'%Y%m') order by DATE_FORMAT(pay_date,'%Y%m') desc) as com on dept.pay_month=com.pay_month
select dept.pay_month, dept.department_id, CASE when comp.comp_avg > dept.dept_avg then 'lower' when comp.comp_avg < dept.dept_avg then 'higher' else 'same' END as comparison from (select date_format(pay_date, '%Y-%m') as pay_month, avg(amount) comp_avg from salary s group by pay_month) as comp join (select e.department_id, date_format(pay_date, '%Y-%m') as pay_month, avg(amount) dept_avg from salary s , employee e where s.employee_id = e.employee_id group by e.department_id, pay_month) as dept on comp.pay_month = dept.pay_month
select dept.pay_month, dept.department_id, case when dept.avg_dept_salary > company.avg_company_salary then 'higher' when dept.avg_dept_salary < company.avg_company_salary then 'lower' else 'same' end as comparison from (select left(s.pay_date, 7) as pay_month, e.department_id, avg(s.amount) as avg_dept_salary from salary s inner join employee e on s.employee_id = e.employee_id group by pay_month, department_id) dept left join (select left(s.pay_date, 7) as pay_month, e.department_id, avg(s.amount) as avg_company_salary from salary s inner join employee e on s.employee_id = e.employee_id group by pay_month) company on dept.pay_month = company.pay_month group by dept.pay_month, dept.department_id
select dept.pay_month, dept.department_id, case when dept.dept_salary > com.com_salary then 'higher' when dept.dept_salary < com.com_salary then 'lower' else 'same' end as comparison from (select substr(s.pay_date, 1, 7) as pay_month, e.department_id, avg(amount) as dept_salary from salary as s join employee as e on s.employee_id = e.employee_id group by 1, 2) as dept join (select substr(pay_date, 1, 7) as pay_month, avg(amount) as com_salary from salary group by 1) as com on dept.pay_month = com.pay_month
select distinct * from ( select substring(pay_date, 1, 7) pay_month, department_id, CASE when avg_dept_sal > avg_sal THEN 'higher' WHEN avg_dept_sal = avg_sal THEN 'same' else 'lower' end comparison from ( select s.*, e.department_id, AVG(amount) over (partition by e.department_id, substring(pay_date, 1, 7)) avg_dept_sal, AVG(amount) over (partition by substring(pay_date, 1, 7)) avg_sal from salary s inner join employee e on s.employee_id = e.employee_id ) a )b order by pay_month desc, department_id, comparison
select distinct date_format(pay_date, '%Y-%m') as pay_month, department_id, case when avg(amount) over(partition by department_id, pay_date) > avg(amount) over(partition by pay_date) then 'higher' when avg(amount) over(partition by department_id, pay_date) < avg(amount) over(partition by pay_date) then 'lower' else 'same' end as comparison from salary as s left join employee as e on s.employee_id = e.employee_id order by 1 desc, 2 asc
select distinct date_format(u.pay_date, '%Y-%m') as pay_month, u.department_id, (case when u.dpt_avg < u.comp_avg then 'lower' when u.dpt_avg > u.comp_avg then 'higher' when u.dpt_avg = u.comp_avg then 'same' end) as comparison from ( select t.*, avg(t.amount) over (partition by t.department_id, t.pay_date ) as dpt_avg, avg(t.amount) over (partition by t.pay_date ) as comp_avg from (select a.*, b.department_id from salary a inner join employee b on a.employee_id = b.employee_id) t) u order by u.pay_date desc, u.department_id asc
select distinct left(pay_date,7) as pay_month, department_id, case when davg>cavg then 'higher' when davg=cavg then 'same' else 'lower' end as comparison from ( select id, s.employee_id, department_id, amount, pay_date, avg(amount) over (partition by left(pay_date,7)) as cavg, avg(amount) over (partition by left(pay_date,7),department_id) as davg from salary s join employee e on s.employee_id=e.employee_id )a order by 1 desc, 2
select distinct pay_month, department_id, (case when dept_avg> com_avg then 'higher' when dept_avg<com_avg then 'lower' else 'same' end ) as comparison from ( select left(pay_date,7) as pay_month, department_id, avg(amount) over(partition by left(pay_date,7), department_id) as dept_avg, avg(amount) over(partition by left(pay_date,7)) as com_avg from salary right join employee on salary.employee_id = employee.employee_id ) as src order by pay_month desc, department_id
select distinct pay_month, department_id, case when avg_dep > avg_comp then 'higher' when avg_dep = avg_comp then 'same' else 'lower' end as comparison from ( select date_format(a.pay_date,'%Y-%m') as pay_month, b.department_id, avg(amount)over(partition by date_format(a.pay_date,'%Y-%m'),department_id) as avg_dep, avg(amount)over(partition by date_format(a.pay_date,'%Y-%m')) as avg_comp from salary a left join employee b on a.employee_id = b.employee_id ) cte order by pay_month, department_id
select distinct pay_month, department_id, case when avg_dep > avg_comp then 'higher' when avg_dep = avg_comp then 'same' else 'lower' end as comparison from ( select left(a.pay_date,7) as pay_month, b.department_id, avg(amount)over(partition by left(a.pay_date,7),department_id) as avg_dep, avg(amount)over(partition by left(a.pay_date,7)) as avg_comp from salary a left join employee b on a.employee_id = b.employee_id ) cte order by pay_month, department_id
select distinct pay_month, department_id, case when avg_dept>avg_salary then 'higher' when avg_dept< avg_salary then 'lower' else 'same' end as comparison from( select substr(pay_date,1,7) as pay_month, department_id, avg(amount) over (partition by substr(pay_date,1,7)) as avg_salary, avg(amount) over(partition by department_id,substr(pay_date,1,7)) as avg_dept from salary as a inner join employee as b on a.employee_id=b.employee_id ) as x order by pay_month desc
select distinct pay_month, department_id, case when company_avg > dept_avg then 'lower' when company_avg < dept_avg then 'higher' else 'same'end as comparison FROM ( SELECT left(pay_date,7) AS pay_month, amount, department_id, avg(amount) over (partition by department_id, pay_date) dept_avg, avg(amount) over (partition by pay_date) company_avg from salary s inner join employee e on s.employee_id = e.employee_id ) a
select distinct pay_month, department_id, case when department_salary < company_salary then 'lower' when department_salary > company_salary then 'higher' when department_salary = company_salary then 'same' end as comparison from ( select date_format(pay_date, '%Y-%m') as pay_month, department_id, avg(amount) over (partition by date_format(pay_date, '%Y-%m'), department_id) as department_salary, avg(amount) over (partition by date_format(pay_date, '%Y-%m')) as company_salary from salary s join employee e on s.employee_id = e.employee_id ) avg_salary
select distinct pay_month,department_id, case when deptsal > globalsal then 'higher' when deptsal < globalsal then 'lower' else 'same' end as comparison from (select date_format(pay_date,'%Y-%m') as pay_month, department_id, avg(amount) over (partition by date_format(pay_date,'%Y-%m'),department_id) as deptsal,avg(amount) over (partition by date_format(pay_date,'%Y-%m')) as globalsal from salary s inner join employee e on s.employee_id = e.employee_id) as t order by pay_month desc,department_id
